,date,retweets,favorites,text,VADER score
97,2019-05-09 09:31:00,38,107,"IRON ORE FUTURES EXTEND COLLAPSE, SLUMP 3.3% TO $92.60/TON",-0.3612
108,2019-08-01 09:31:00,22,124,"Our 3 largest exports are iron ore , coal & education All 3 have a single point of failure: Iron ore : fall in price of iron ore Coal: fall in price of coal (coking & thermal) Education: Chinese Govt discouraging students from coming here We need to urgently diversify our economy",-0.7351
0,2019-08-12 09:31:00,2,13,"MDOT Pic of the Day: It's always a great time to explore Michigan's Iron Ore Heritage Trail in the U.P., but it's even better in the fall! pic.twitter.com/05R0a4d8k8",0.7712
36,2019-09-16 09:31:00,53,105,"Enugu- Coal, Iron ore , beautiful topography(tourism),agriculture, Ebonyi- Limestone, salt, rice, agriculture, Anambra- Business, natural gas Imo- Oil, Entertainment Abia- Industrial/creative hub, Oil, Lead. Etc These are the potentials in S.E that our Govts are sleeping on.",0.8481
53,2019-02-11 09:31:00,114,110,"Why is the US suddenly interested in Greenland, and so as Russia and China? Because of its strategic value and widely believed natural resources, including zinc, lead, gold, iron ore , heavy and light rare earth elements, copper and oil. https://www. thelocal.dk/20190817/why-d oes-the-us-suddenly-care-about-greenland …",0.765
56,2019-09-02 09:31:00,14,71,"The Steelers colors are Black and Gold, not Black and Yellow.. The colors represent two ingredients used to create steel... Black represents Coal and Gold represents Iron Ore . #HistoryLesson #BlackAndGold https:// twitter.com/ZBNFL/status/1 167944750948732932 …",0.2732
93,2019-06-10 09:31:00,175,690,"The spectacular Chitrakote falls of Chattisgarh! The Indravati river is magnificent in this season. There is iron ore in this region, but we should decide whether we need mining in all the places that minerals and ores occur or fresh water. #WednesdayWisdom pic.twitter.com/G2CEYxePC6",0.69
37,2019-09-16 09:31:00,58,102,"Iron ore gets the headlines but tourism makes the jobs - and Chinese visitor arrivals have been flat for two years. (Fortunately, foreign women in their 20s and 50s still love us) https:// thenewdaily.com.au/money/finance- news/2019/09/13/china-tourism-numbers-australia/ …",0.7783
87,2019-11-11 09:31:00,23,31,"DCE Iron Ore Spot index declines 9 days in a row. Iron Ore futures -5.1%, low 609.5 RMB, 607 limit down pic.twitter.com/2dzV1H0ooq",-0.2732
88,2019-11-11 09:31:00,31,51,"Chinese rebar steel inventory at highest level seen for this time of year in 6yrs. The price of Chinese rebar is at lowest level in 15 months in US$ terms. This slide in Chinese steel prices/ inventory rise, has played an important role in very sharp reversal in iron ore prices. pic.twitter.com/4K9sT7zxRD",0.1531
103,2019-03-11 09:31:00,21,83,"movement of grain, flour, iron ore , corn, and oats on the great lakes. the maps with red are from 1909, the ones with green from 1923 pic.twitter.com/xep5CgDWM6",0.6249
