,date,retweets,favorites,text,VADER score
4,2019-01-10 09:31:00,19,93,"Libs waffle on about how good they are at managing the economy, truth is it’s all a charade based on record low rates, iron ore , population growth & housing. Libs also say they are going to reduce debt (never do) & hypercritically want the young to take debt on. No vision, joke.",0.4588
6,2019-05-10 09:31:00,56,1290,"The blue stuff on your map is easier to move goods over than the green stuff. Average sea freight time to Dampier from China is 9 days (Sydney is 15, but a lot of our iron ore and coal ships from up north). To the UK it's 29.",0.2263
7,2019-04-10 09:31:00,4,17,"India is now the world's 2nd largest producer of crude steel at 114mtpa and will be importing about 40-50mt ironore in 2020. This, along with Vietnam's surge and rising steel output in MENA, will keep #ironore market tight for the rest of the decade. New price highs coming. https:// twitter.com/FIMI_India/sta tus/1179992627506073600 …",-0.5719
11,2019-01-10 09:31:00,4,32,"As part of annual Reward & Recognition Program, on the occasion of OMC’s 64th #AnnualDay , Daitari Iron Ore Mines team led by Mr. Subrat Mishra bagged the Best Region Award (2018-19) for its overall achievement in #Mining activities including sales and production. pic.twitter.com/LTDH9fuRty",0.9081
12,2019-01-10 09:31:00,4,17,"As part of annual Reward & Recognition Program, on the occasion of OMC’s 64th #AnnualDay , South Kaliapani Chromite Mines, Kurmitar Iron Ore Mines and Sukurangi Chromite Mines bagged the Best Performing Mines 2018-19 awards for their overall achievements in #Mining activities. pic.twitter.com/piN1C5Nu3d",0.8979
14,2019-01-10 09:31:00,23,62,"In another recent order, @SAILsteel has been allowed to offload in a year up to a quantity equivalent to maximum 25% of total iron ore production in the previous year. We are committed to ensuring raw material securitization for the Indian steel industry.",0.5267
16,2019-09-27 09:31:00,16,45,"Vale, the world's largest iron ore miner, plans to supply high grade iron ore pellet feed & pellets to meet rising demand. Zanaga strategy aligned, and will produce an even higher quality product at 66-68.5% iron #ZIOC #zanaga #ironore #Congo #China #steel https://www. argusmedia.com/en/news/198438 7-vale-to-sell-iocj-as-iron-ore-pellet-feed …",-0.128
17,2019-09-27 09:31:00,116,386,"Sindh Environment Protection Agecy has sealed an illegal factory making iron ore by mixing of coal, iron chip & husk in Karachi. The factory with heavy blowers was emitting hazardous smoke which causes damage to environment & human-health seriously. Good job SEPA pic.twitter.com/0NT1dxn9ht",-0.6808
18,2019-09-27 09:31:00,10,21,Great call from @Barchart .!! Zanaga Iron Ore Co. @Zanaga_ Iron_Ore sat on one of the largest iron ore deposits in the World. Current Price = 11.74p. #ZIOC pic.twitter.com/2BN0UCeKey,0.6892
20,2019-09-25 09:31:00,238,1078,"We import coal and iron ore , despite the huge deposits we have. Iron ore is used to produce Iron, which is then used to produce Steel. Steel is used to produce Automobiles pic.twitter.com/9pExYdMahd",-0.2411
22,2019-09-24 09:31:00,17,132,I forgot this wild concept art was at the #Disneyland Hotel. Indiana Jones iron ore cart coaster & jeep adventure. Jungle Cruise boat teetering over the edge of a waterfall! DLRR chugging through the massive temple show building! Nina Rae Vaughn. pic.twitter.com/tVgsXe1aTA,0.4374
23,2019-09-22 09:31:00,25,50,Now that we are past the Northern Summer and the world gets back to work the outlook for #copper just keeps on getting better. All time record shorts on the CoT and real tightness in the copper cons market says copper will soon be following #ironore on its way to new AT highs pic.twitter.com/x7DlwjciIM,0.4404
24,2019-09-22 09:31:00,44,142,The Iron Whore...sorry.. iron ore ...rapidly became the centre-piece of the night...everyone deliberately oblivious to the fact that every cent she has was stolen from the Indigenous Australians...,-0.4939
25,2019-09-21 09:31:00,44,153,"Reviewed the performance of @nmdclimited , one of the largest mining companies of India in the presence of Shri @kishanreddybjp and senior officials of @SteelMinIndia . Instructed #NMDC to focus on increasing iron ore production and maximising productivity and profitability. pic.twitter.com/r4XsOSFY0s",0.2732
26,2019-09-21 09:31:00,38,62,". @JSPLCorporate 's TRB Iron Ore Mines in Tensa, #Odisha bags prestigious Mining Innovation Award by The Indian Mining & Engineering Journal for efforts to ensure eco-friendly and ecological balance in an ecologically fragile environment. Congratulations! @MPNaveenJindal pic.twitter.com/9MnQICO7tZ",0.9168
27,2019-09-21 09:31:00,8,32,After a year’s wait the Centre agrees to increasing cap of iron ore holdings in Odisha. Move to allow resumption of auctions and @TataSteelLtd ‘s participation in these http://www. ecoti.in/vXqgxZ91 via @economictimes,0.4019
28,2019-09-19 09:31:00,25,46,#China ’s #IronOre futures extend loss to 4.6% Singapore iron ore futures fell below $90 pic.twitter.com/MV6DFvE3tE,-0.1531
39,2019-12-09 09:31:00,257,390,Why no raw materials? Because there is no rail to take iron ore from Itakpe to Ajaokuta. Why no railway from Itakpe to Ajaokuta? Because NIOMCO in Itakpe is moribund and not functional thus cannot convert Itakpe iron ore to high grade ore for the furnace in Ajaokuta.,-0.7149
40,2019-12-09 09:31:00,257,395,"3. Railway: 15m tonnes of iron ore cannot be moved by road, as it will destroy the roads, thus a railway was to be built from Itakpe to Ajaokuta to take iron ore from the beneficiation plan in Itakpe to the Ajaokuta. Rail link not working today",-0.4767
42,2019-10-09 09:31:00,31,67,Honoured to be invited by China Development Bank and COIDIC to join the 5th Investing in Africa Forum with the World Bank and Rep. of Congo gov #ZIOC #Zanaga #ironore #infrastructure #China #Glencore #WorldBank #ChinaDevelopmentBank #Brazzaville #InvestinginAfricaForum #Congo pic.twitter.com/0a8h3tvKAF,0.6597
43,2019-10-09 09:31:00,98,84,"43,000 hectares of protected indigenous land and prime elephant habitat on the chopping block for iron ore in Jharkhand's Saranda forests reports @ikukreti . CM @dasraghubar bats to protect mining interests. What will @PrakashJavdekar #COP14 chair choose? https://www. downtoearth.org.in/news/mining/ce ntre-may-open-43-000-ha-of-jharkhand-s-saranda-forest-for-mining-66569?fbclid=IwAR1Jch4lGq45fQ-LALzvSymddTDijSXmLB6Et9y5uTXCsZ2L-DjaIyChoYo …",0.6072
47,2019-06-09 09:31:00,19,20,Billionaire mining investor Robert Friedland wins the rights to an iron ore deposit in Guinea that owners including BHP have left fallow for years https:// bloom.bg/2LtmCqy,0.5719
48,2019-06-09 09:31:00,22,22,"Committee of Secretaries suggests amendment to definition of “illegal mining” in mining act, seeks to save @CoalIndiaHQ from a liability of Rs 53,000 crore after #Odisha iron ore miners paying Rs 19,000 core http://www. ecoti.in/WJBDyZ via @economictimes",0.34
49,2019-05-09 09:31:00,16,43,A surplus on the volatile iron ore is all Aust has at present. Nothing else to hold off a recession. https:// twitter.com/JohnSaunders88 8/status/1169559121688809472 …,-0.4215
51,2019-04-09 09:31:00,35,106,"Nigeria is Africa's largest economy, largest oil, cement producer. Has Africa's largest gas reserves, 2nd largest iron ore , coal reserves, largest rice mill, 3rd largest foreign reserves, 2nd biggest banking sector. No. 3 investment destination. We are a powerhouse in Africa.",-0.29600000000000004
52,2019-03-09 09:31:00,31,54,"Mining is the strongest performer in the 2nd quarter. Main contributors to the 3.1% positive growth in the sector include iron ore , manganese & coal. Mining is about a number of minerals that we must protect & position ourselves to play our role in the economy. #StatsSA @DMR_SA pic.twitter.com/aZ5xo6ZnfG",0.9246
55,2019-02-09 09:31:00,28,80,"#China ’s #IronOre futures rebounding for 2nd straight day, surging 5.6% for now pic.twitter.com/S9DWSe9CEH",0.2263
57,2019-08-30 09:31:00,40,198,"Found the base of the 13th century shaft furnace today with @SMLarchaeology . Used for smelting iron ore , it would orginally have looked something like this (second image via https://www. haraldthesmith.com/iron-smelting- part-iv-furnace-design/ … ) pic.twitter.com/OROmUpqy6z",0.3612
58,2019-08-30 09:31:00,39,74,"#OnThisDay 1984. Striking miners from four pits in the Gwent Valley, South Wales, seized a transporter bridge at Newport. The miners attempted to block supplies of iron ore and coal to British Steel’s strip mill at Llanwern by blocking the movement of ships.",-0.6705
62,2019-08-25 09:31:00,5,28,"MANDALORIAN IRON, also known as BESKAR, was an extremely durable iron ore only found in world of Mandalore and its moon, Concordia. Mandalorians Mandalore mined their planet for beskar, using it in the creation of weapons, armor, and starships (continued) pic.twitter.com/Ie8WpwLy2V",-0.2023
63,2019-08-23 09:31:00,96,104,"#CNBCTV18Exclusive Watch our MD V R Sharma, who was on @CNBCTV18Live earlier today to discuss about Angul ramps up, iron ore availabilities, our debt reduction plans and many more important issues. pic.twitter.com/2LMtj4AqcK",-0.1045
64,2019-08-23 09:31:00,15,40,"When Norway found oil & gas in the early seventies the principle of who owns the resources (that'll be the the people) was well established and uncontested, unlike in Oz where Lang Hancock could fly over the Pilbara, discover iron ore and say I'll have all of that, thank you"".""",0.5574
66,2019-08-22 09:31:00,21,43,I’m speechless. A joke? “It can’t be ignored that Australian iron ore exports could potentially be then used to support warship production.” Chinese military: Security experts fear Australian iron ore being used for Chinese submarines | Herald Sun https://www. heraldsun.com.au/news/experts-f ear-aussie-steel-being-used-for-chinese-submarines/news-story/b48a698f5bc0be57e124df8bee196dfe …,0.0258
67,2019-08-22 09:31:00,37,68,"Further signs of slowdown: Iron ore prices slumped to their lowest levels since March, part of a wider 30% slump this month (FT) Copper futures fell in New York for four of the past five months. Aluminium weakness signals persistent overcapacity. pic.twitter.com/5CTXLGUdX1",-0.6597
68,2019-08-22 09:31:00,12,26,"Don't let Venture Minerals play dice with takayna /Tarkine. In a move that smacks more of manipulating permits, Venture Minerals has announced decision to commence mining at Riley Creek despite three straight weeks of plummetting iron ore prices. http:// bobbrown.org.au/mr_220819 #politas",-0.2604
72,2019-08-21 09:31:00,35,46,"Shock of the day - iron ore price takes another leg down. (62% down at $91 [-3.2%] from $120 at end July.) Fall not a surprise. Producers holding up well. Also 8 stocks that have lost more than 25% in Aug: Massmart, Aspen, Discovery, Mpact, Grindrod, Truworths, EOH & Steinhoff.",-0.5594
74,2019-08-20 09:31:00,143,740,"The Green New Deal!! Greenland is the world's largest island rich in oil, zinc, lead, iron ore , gold and diamonds! Home of Sirius Sled Dog Patrol"" an elite naval unit, the hardest special forces in the world to join!! The possibilities are endless. #GoGreen #GreenlandUSA pic.twitter.com/I5H9odZvBz""",0.8647
75,2019-08-20 09:31:00,22,41,Exclusive: Australia has warned it may cancel a China-backed mining company's permit to access its own iron ore mine which lies close to one of the nation's most highly sensitive defence sites https://www. smh.com.au/politics/feder al/australia-may-bar-china-backed-firm-from-a-mine-it-owns-on-a-missile-site-20190820-p52isk.html?utm_medium=Social&utm_source=Twitter#Echobox=1566293028 …,-0.5358
78,2019-08-16 09:31:00,292,295,"Trump wants to buy Greenland? potential for many natural resources including zinc, lead, gold, iron ore , heavy & light rare earth elements, copper & oil China has made several efforts to gain an economic presence on the island, according to the report."" https:// portermedium.com/2019/08/report -trump-has-floated-the-idea-of-buying-greenland/ …""",0.7096
82,2019-12-08 09:31:00,44,265,"Visited @SAILsteel ’s captive iron ore mine in Gua, Jharkhand. Impressed by the positivity of colleagues here. We discussed on a roadmap to enhance capacity of Gua iron ore mine to make it the best mine in the country both in production volumes and in sustainable mining. pic.twitter.com/PWTa1lb3h8",0.8909999999999999
83,2019-12-08 09:31:00,20,59,"- The construction sector is projected to shed 100,000 jobs by the end of 2019 - Retail remains in a recession"" - Iron ore has plummeted almost 30% in the last 2 weeks. - The chance of a global recession is as high as ~80% by the end of 2020. #TheSurplusIsToast #GiveUpScoMo""",-0.5574
84,2019-12-08 09:31:00,47,288,Visited @TataSteelLtd ’s Iron ore mines in Noamundi. Happy to know that Tata Steel has commissioned a solar power plant at the mines to reduce the carbon footprints. The solar power plant is a first to be set up in any iron ore mine of the country. pic.twitter.com/CMmc3nk45q,0.5719
85,2019-12-08 09:31:00,24,30,"Iron ore sank toward $80 a ton, extending this month’s rout, after China poured fuel on demand fears https:// bloom.bg/31tsR3K",-0.5106
86,2019-12-08 09:31:00,30,45,"#China ’s #IronOre futures extend losses on Monday, tumbling 4.7% to hit NEW LOW in nearly three month on downbeat outlook for demand and rising stockpiles. https://www. yuantalks.com/chinas-iron-or e-futures-two-month-low-as-turning-point-in-supplies-emerges/ … pic.twitter.com/xjmGSMMLUC",-0.6523
92,2019-07-08 09:31:00,14,32,"#China ’s #IronOre futures close 5% down to the lowest in over 2 months, limit down intraday. #CrudeOil futures down 2.4%. pic.twitter.com/m7ceLU9xia",-0.3818
94,2019-06-08 09:31:00,15,30,"Kaboom! Iron ore hit again. MBIOI-58 -1.8% to $86.34 MBIOI-62 -3% to $97.55 MBIOI-65-BZ -3.4% to $106.70 Now down 20.4%, 22.4% and 19.8% respectively from the recent cyclical highs #bearmarket pic.twitter.com/pyE0c7LSWP",0.4003
98,2019-05-08 09:31:00,23,49,"Iron ore walloped again, especially lower grades. MBIOI-58 -15.9% to $87.88 MBIOI-62 -6.7% to $100.56 MBIOI-65-BZ -6.5% to $110.50 The decline for 58% fines was the largest since daily spot pricing began in 2013. All 3 grades sit at multi-month lows. pic.twitter.com/yhPmshK754",-0.5095
99,2019-05-08 09:31:00,11,20,"It does look like the unsustainable rise in iron ore prices was, well, unsustainable. Vale production is coming back & in a win for economics, rising supply relative to a given level of demand = lower prices How low will it go?",0.5574
100,2019-05-08 09:31:00,11,22,"Always consider buying the Right #Building Materials for your Construction purposes. It is always worth considering factors like Requirement, Costs, Durability & Availability. #KanaraTMT #TMTsteelbar #Construction #Tmts #steelfacts #ironore #SteelTruth pic.twitter.com/KOlCMXkt65",0.5267
101,2019-05-08 09:31:00,35,41,Iron ore futures collapse back below $100 as rout gathers pace https:// bloom.bg/2yCnao3 pic.twitter.com/1sN0rTB3Sg,-0.4939
102,2019-05-08 09:31:00,124,200,Shock of the day: Rand at 14.86 to dollar. China halts US agriculture imports. Equity markets tumbling - S&P500 futures down over 1%. To add to out woes iron ore price collapsing. Now below $100 on increasing supplies from Brazil and easing Chinese demand. Manic Monday.,-0.7351
104,2019-03-08 09:31:00,9,67,"Theory: 'Arry and Bert are at Ffarquhar Quarry all the tine because they now mine iron ore , so they're apways there collecting it and taking it to the ironworks. (I know it doesn't look like iron ore in the trucks but whatever) pic.twitter.com/ptlw6r8fg3",-0.1419
105,2019-03-08 09:31:00,330,586,"African Natural Resources and Mines signed a deal with Nigeria to invest $600million in iron ore and steel production. Their plant will also generate enough heat that will produce 34mw electricity,and supply from their kaduna plant. This is a major boost to our steel production. pic.twitter.com/C5gu9P8cJs",0.6369
106,2019-02-08 09:31:00,1059,1003,"#AndhraPradesh IFS officer Kallol Biswas who had earned fame after serving notices to Bellary mining king #GaliJanardhanReddy for alleged irregularities"" done by his Obulapuram Mining Corporation and encroaching forest land for illegal iron ore mining sacked by the centre. pic.twitter.com/w0VTC9TiEJ""",-0.1779
107,2019-01-08 09:31:00,62,61,"Since 2013, #Soros has spent $41.9 million financing #OpenBorders #NGOs & Liberal protest groups. He is currently sued by the state of Israel for $10 billion for orchestrating the African country of Guinea’s freezing of Israeli iron ore mining contracts! https://www. lifesitenews.com/news/billionai re-leftist-soros-pouring-more-money-into-lobbying-efforts …",-0.4003
23,2019-09-23 09:31:00,25,50,Now that we are past the Northern Summer and the world gets back to work the outlook for #copper just keeps on getting better. All time record shorts on the CoT and real tightness in the copper cons market says copper will soon be following #ironore on its way to new AT highs pic.twitter.com/x7DlwjciIM,0.4404
24,2019-09-23 09:31:00,44,142,The Iron Whore...sorry.. iron ore ...rapidly became the centre-piece of the night...everyone deliberately oblivious to the fact that every cent she has was stolen from the Indigenous Australians...,-0.4939
47,2019-06-10 09:31:00,19,20,Billionaire mining investor Robert Friedland wins the rights to an iron ore deposit in Guinea that owners including BHP have left fallow for years https:// bloom.bg/2LtmCqy,0.5719
48,2019-06-10 09:31:00,22,22,"Committee of Secretaries suggests amendment to definition of “illegal mining” in mining act, seeks to save @CoalIndiaHQ from a liability of Rs 53,000 crore after #Odisha iron ore miners paying Rs 19,000 core http://www. ecoti.in/WJBDyZ via @economictimes",0.34
62,2019-08-26 09:31:00,5,28,"MANDALORIAN IRON, also known as BESKAR, was an extremely durable iron ore only found in world of Mandalore and its moon, Concordia. Mandalorians Mandalore mined their planet for beskar, using it in the creation of weapons, armor, and starships (continued) pic.twitter.com/Ie8WpwLy2V",-0.2023
82,2019-12-09 09:31:00,44,265,"Visited @SAILsteel ’s captive iron ore mine in Gua, Jharkhand. Impressed by the positivity of colleagues here. We discussed on a roadmap to enhance capacity of Gua iron ore mine to make it the best mine in the country both in production volumes and in sustainable mining. pic.twitter.com/PWTa1lb3h8",0.8909999999999999
83,2019-12-09 09:31:00,20,59,"- The construction sector is projected to shed 100,000 jobs by the end of 2019 - Retail remains in a recession"" - Iron ore has plummeted almost 30% in the last 2 weeks. - The chance of a global recession is as high as ~80% by the end of 2020. #TheSurplusIsToast #GiveUpScoMo""",-0.5574
84,2019-12-09 09:31:00,47,288,Visited @TataSteelLtd ’s Iron ore mines in Noamundi. Happy to know that Tata Steel has commissioned a solar power plant at the mines to reduce the carbon footprints. The solar power plant is a first to be set up in any iron ore mine of the country. pic.twitter.com/CMmc3nk45q,0.5719
85,2019-12-09 09:31:00,24,30,"Iron ore sank toward $80 a ton, extending this month’s rout, after China poured fuel on demand fears https:// bloom.bg/31tsR3K",-0.5106
86,2019-12-09 09:31:00,30,45,"#China ’s #IronOre futures extend losses on Monday, tumbling 4.7% to hit NEW LOW in nearly three month on downbeat outlook for demand and rising stockpiles. https://www. yuantalks.com/chinas-iron-or e-futures-two-month-low-as-turning-point-in-supplies-emerges/ … pic.twitter.com/xjmGSMMLUC",-0.6523
25,2019-09-23 09:31:00,44,153,"Reviewed the performance of @nmdclimited , one of the largest mining companies of India in the presence of Shri @kishanreddybjp and senior officials of @SteelMinIndia . Instructed #NMDC to focus on increasing iron ore production and maximising productivity and profitability. pic.twitter.com/r4XsOSFY0s",0.2732
26,2019-09-23 09:31:00,38,62,". @JSPLCorporate 's TRB Iron Ore Mines in Tensa, #Odisha bags prestigious Mining Innovation Award by The Indian Mining & Engineering Journal for efforts to ensure eco-friendly and ecological balance in an ecologically fragile environment. Congratulations! @MPNaveenJindal pic.twitter.com/9MnQICO7tZ",0.9168
27,2019-09-23 09:31:00,8,32,After a year’s wait the Centre agrees to increasing cap of iron ore holdings in Odisha. Move to allow resumption of auctions and @TataSteelLtd ‘s participation in these http://www. ecoti.in/vXqgxZ91 via @economictimes,0.4019
52,2019-03-11 09:31:00,31,54,"Mining is the strongest performer in the 2nd quarter. Main contributors to the 3.1% positive growth in the sector include iron ore , manganese & coal. Mining is about a number of minerals that we must protect & position ourselves to play our role in the economy. #StatsSA @DMR_SA pic.twitter.com/aZ5xo6ZnfG",0.9246
55,2019-02-11 09:31:00,28,80,"#China ’s #IronOre futures rebounding for 2nd straight day, surging 5.6% for now pic.twitter.com/S9DWSe9CEH",0.2263
94,2019-06-10 09:31:00,15,30,"Kaboom! Iron ore hit again. MBIOI-58 -1.8% to $86.34 MBIOI-62 -3% to $97.55 MBIOI-65-BZ -3.4% to $106.70 Now down 20.4%, 22.4% and 19.8% respectively from the recent cyclical highs #bearmarket pic.twitter.com/pyE0c7LSWP",0.4003
1,2019-05-10 15:04:00,18,110,"Just one more. Northants churches are special to me because, being a non-driver, I can only visit them by taking the 0600 train from Ipswich and cycling out from Peterborough, Stamford or Oakham to enter the land of stone. Here's Woodford, in the iron ore belt. #SaturdaySteeples pic.twitter.com/fVymcISfQI",0.4019
3,2019-01-10 14:51:00,100,123,When the Law Itself Hinders Business:”It is not just delay but erroneous application of the law that results in undermining business. An example of both delay and judicial error resulting in massive economic harm is the cessation of iron ore mining in Goa” https:// economictimes.indiatimes.com/blogs/et-edito rials/when-the-law-itself-hinders-business/ …,-0.9235
4,2019-01-10 06:10:00,19,93,"Libs waffle on about how good they are at managing the economy, truth is it’s all a charade based on record low rates, iron ore , population growth & housing. Libs also say they are going to reduce debt (never do) & hypercritically want the young to take debt on. No vision, joke.",0.4588
6,2019-05-10 04:33:00,56,1290,"The blue stuff on your map is easier to move goods over than the green stuff. Average sea freight time to Dampier from China is 9 days (Sydney is 15, but a lot of our iron ore and coal ships from up north). To the UK it's 29.",0.2263
7,2019-04-10 03:23:00,4,17,"India is now the world's 2nd largest producer of crude steel at 114mtpa and will be importing about 40-50mt ironore in 2020. This, along with Vietnam's surge and rising steel output in MENA, will keep #ironore market tight for the rest of the decade. New price highs coming. https:// twitter.com/FIMI_India/sta tus/1179992627506073600 …",-0.5719
9,2019-03-10 10:54:00,211,449,We always have one excuse or d other not to tap into other resources that aren't crude oil. ust d same way our multi bn $ iron ore deposits were abandoned bcos of their garangue minerals content when we can actually improve their economic values thru beneficiation #VoiceOfTheDon pic.twitter.com/akVszgeyHz,0.7429
11,2019-01-10 00:25:00,4,32,"As part of annual Reward & Recognition Program, on the occasion of OMC’s 64th #AnnualDay , Daitari Iron Ore Mines team led by Mr. Subrat Mishra bagged the Best Region Award (2018-19) for its overall achievement in #Mining activities including sales and production. pic.twitter.com/LTDH9fuRty",0.9081
12,2019-01-10 02:26:00,4,17,"As part of annual Reward & Recognition Program, on the occasion of OMC’s 64th #AnnualDay , South Kaliapani Chromite Mines, Kurmitar Iron Ore Mines and Sukurangi Chromite Mines bagged the Best Performing Mines 2018-19 awards for their overall achievements in #Mining activities. pic.twitter.com/piN1C5Nu3d",0.8979
14,2019-01-10 08:06:00,23,62,"In another recent order, @SAILsteel has been allowed to offload in a year up to a quantity equivalent to maximum 25% of total iron ore production in the previous year. We are committed to ensuring raw material securitization for the Indian steel industry.",0.5267
16,2019-09-27 09:04:00,16,45,"Vale, the world's largest iron ore miner, plans to supply high grade iron ore pellet feed & pellets to meet rising demand. Zanaga strategy aligned, and will produce an even higher quality product at 66-68.5% iron #ZIOC #zanaga #ironore #Congo #China #steel https://www. argusmedia.com/en/news/198438 7-vale-to-sell-iocj-as-iron-ore-pellet-feed …",-0.128
17,2019-09-27 06:12:00,116,386,"Sindh Environment Protection Agecy has sealed an illegal factory making iron ore by mixing of coal, iron chip & husk in Karachi. The factory with heavy blowers was emitting hazardous smoke which causes damage to environment & human-health seriously. Good job SEPA pic.twitter.com/0NT1dxn9ht",-0.6808
18,2019-09-27 04:30:00,10,21,Great call from @Barchart .!! Zanaga Iron Ore Co. @Zanaga_ Iron_Ore sat on one of the largest iron ore deposits in the World. Current Price = 11.74p. #ZIOC pic.twitter.com/2BN0UCeKey,0.6892
19,2019-09-25 11:24:00,72,104,"Changing ownership of mines without a reason is unheard of. It'll be catastrophic if supply of 70 Mt. of iron ore is disrupted, lakhs of jobs will be lost. Successfully running a mine involves yrs of hard-work, investments in infrastructure, tech., logistics & social development. https:// twitter.com/ETIndustryNews /status/1176759046105382913 …",-0.3182
