,date,retweets,favorites,text,VADER score
20,2019-09-25 07:48:00,238,1078,"We import coal and iron ore , despite the huge deposits we have. Iron ore is used to produce Iron, which is then used to produce Steel. Steel is used to produce Automobiles pic.twitter.com/9pExYdMahd",-0.2411
22,2019-09-24 01:01:00,17,132,I forgot this wild concept art was at the #Disneyland Hotel. Indiana Jones iron ore cart coaster & jeep adventure. Jungle Cruise boat teetering over the edge of a waterfall! DLRR chugging through the massive temple show building! Nina Rae Vaughn. pic.twitter.com/tVgsXe1aTA,0.4374
23,2019-09-22 08:31:00,25,50,Now that we are past the Northern Summer and the world gets back to work the outlook for #copper just keeps on getting better. All time record shorts on the CoT and real tightness in the copper cons market says copper will soon be following #ironore on its way to new AT highs pic.twitter.com/x7DlwjciIM,0.4404
24,2019-09-22 00:02:00,44,142,The Iron Whore...sorry.. iron ore ...rapidly became the centre-piece of the night...everyone deliberately oblivious to the fact that every cent she has was stolen from the Indigenous Australians...,-0.4939
25,2019-09-21 07:46:00,44,153,"Reviewed the performance of @nmdclimited , one of the largest mining companies of India in the presence of Shri @kishanreddybjp and senior officials of @SteelMinIndia . Instructed #NMDC to focus on increasing iron ore production and maximising productivity and profitability. pic.twitter.com/r4XsOSFY0s",0.2732
26,2019-09-21 06:49:00,38,62,". @JSPLCorporate 's TRB Iron Ore Mines in Tensa, #Odisha bags prestigious Mining Innovation Award by The Indian Mining & Engineering Journal for efforts to ensure eco-friendly and ecological balance in an ecologically fragile environment. Congratulations! @MPNaveenJindal pic.twitter.com/9MnQICO7tZ",0.9168
27,2019-09-21 05:01:00,8,32,After a year’s wait the Centre agrees to increasing cap of iron ore holdings in Odisha. Move to allow resumption of auctions and @TataSteelLtd ‘s participation in these http://www. ecoti.in/vXqgxZ91 via @economictimes,0.4019
28,2019-09-19 03:57:00,25,46,#China ’s #IronOre futures extend loss to 4.6% Singapore iron ore futures fell below $90 pic.twitter.com/MV6DFvE3tE,-0.1531
29,2019-09-16 15:06:00,23,35,"Senior advocate Harish Salve has blamed the Supreme Court for India’s current economic slowdown. with judgments like 2G, coal block allocation and Goa iron ore mining, the Supreme Court has caused harm to the Indian economy. https:// theprint.in/india/governan ce/judiciary/supreme-court-squarely-to-blame-for-economic-slowdown-says-senior-advocate-harish-salve/292115/amp/?__twitter_impression=true …",0.0516
30,2019-09-16 12:07:00,259,942,"Governor Nasir Ahmad @elrufai is on a site visit to the African Natural Resources & Mines $600 million integrated iron ore mining processing & steel production company situated at Gujeni, Kagarko LGA, Kaduna State. pic.twitter.com/5K44MbM1dj",0.3612
31,2019-09-16 11:05:00,45,104,Government of India has given permission to sell 70 million tonnes of sub grade minerals in the captive mines of SAIL. This would enable @SAILsteel to lead the way in ensuring availability of iron ore in the years up ahead for the steel sector. Thank you @MinesMinIndia,0.5574
32,2019-09-16 11:04:00,55,162,Government of India has taken a decisive step in assuring the supply of iron ore for India’s steel sector by allowing SAIL to sell 25% of its total mineral production in a year. We thank the @MinesMinIndia for this initiative.,0.7184
33,2019-09-16 10:51:00,17,30,"Harish Salve says with judgments like 2G, coal block allocation and Goa iron ore mining, the Supreme Court has caused harm to the Indian economy. https:// theprint.in/india/governan ce/judiciary/supreme-court-squarely-to-blame-for-economic-slowdown-says-senior-advocate-harish-salve/292115/amp/?__twitter_impression=true …",-0.0772
34,2019-09-15 11:54:00,14,25,"For all the people who dislike coal and plastic waste. As a Geologist,I noticed a very interesting Geology video.With a heat source, in lab, the carbon from plastics,in this case a plastic bottle combined with iron ore creates steel.Coal is no longer needed.",-0.3626
35,2019-09-15 10:16:00,73,87,"Saranda is Asia's finest,largest sal forest:ature's #cathedral ,a university for foresters, #tiger & #elephant habitat, watershed of #rivers but all that humans see is the iron ore underneath. to raze this #forest is a crime. #SaveSaranda #ClimateBreakdown https://www. downtoearth.org.in/news/mining/ce ntre-may-open-43-000-ha-of-jharkhand-s-saranda-forest-for-mining-66569?fbclid=IwAR1ksvp2CH9UjuXC9JkwxSr2XCOnaEyA54nfzZWJJAUK5imviRwWD0nT1QY …",-0.6956
39,2019-12-09 09:28:00,257,390,Why no raw materials? Because there is no rail to take iron ore from Itakpe to Ajaokuta. Why no railway from Itakpe to Ajaokuta? Because NIOMCO in Itakpe is moribund and not functional thus cannot convert Itakpe iron ore to high grade ore for the furnace in Ajaokuta.,-0.7149
40,2019-12-09 09:23:00,257,395,"3. Railway: 15m tonnes of iron ore cannot be moved by road, as it will destroy the roads, thus a railway was to be built from Itakpe to Ajaokuta to take iron ore from the beneficiation plan in Itakpe to the Ajaokuta. Rail link not working today",-0.4767
41,2019-11-09 12:49:00,5,17,"Die @PolizeiStmk nimmt an der Katastrophenschutzübung „ Ironore 2019 teil. Informationen zur Übung gibt es auf http:// Henri.FM . 23 Personen gestalten 80 h Live-Programm. Einschalten lohnt sich! Ab 6:00 Uhr startet der Sender. http://www. ironore.eu Adobe Stock pic.twitter.com/ohsLRX95wC""",-0.636
42,2019-10-09 07:54:00,31,67,Honoured to be invited by China Development Bank and COIDIC to join the 5th Investing in Africa Forum with the World Bank and Rep. of Congo gov #ZIOC #Zanaga #ironore #infrastructure #China #Glencore #WorldBank #ChinaDevelopmentBank #Brazzaville #InvestinginAfricaForum #Congo pic.twitter.com/0a8h3tvKAF,0.6597
43,2019-10-09 05:45:00,98,84,"43,000 hectares of protected indigenous land and prime elephant habitat on the chopping block for iron ore in Jharkhand's Saranda forests reports @ikukreti . CM @dasraghubar bats to protect mining interests. What will @PrakashJavdekar #COP14 chair choose? https://www. downtoearth.org.in/news/mining/ce ntre-may-open-43-000-ha-of-jharkhand-s-saranda-forest-for-mining-66569?fbclid=IwAR1Jch4lGq45fQ-LALzvSymddTDijSXmLB6Et9y5uTXCsZ2L-DjaIyChoYo …",0.6072
44,2019-07-09 13:00:00,162,232,"Companies which have invested thousands of crores in steel plants & have created employment in thousands should be given preference in iron ore auction,” our Chairman @MPNaveenJindal urges #Odisha Government. http:// orissadiary.com/jspl-chief-nav een-jindal-meets-chief-secretary-secretaries-state-government-odisha/ …""",0.25
46,2019-06-09 11:08:00,25,32,"The effects of the 2008 Beijing Olympics are still evident in Goa. The rush to export iron ore from Goa to satiate China’s building frenzy in the run up to the games and after degraded large swaths of what was once good tree canopy cover."" https://www. downtoearth.org.in/news/mining/de sertification-in-india-mining-monstrous-for-goa-but-urbanisation-digs-a-bigger-hole-66544 …""",-0.29600000000000004
47,2019-06-09 05:33:00,19,20,Billionaire mining investor Robert Friedland wins the rights to an iron ore deposit in Guinea that owners including BHP have left fallow for years https:// bloom.bg/2LtmCqy,0.5719
48,2019-06-09 04:34:00,22,22,"Committee of Secretaries suggests amendment to definition of “illegal mining” in mining act, seeks to save @CoalIndiaHQ from a liability of Rs 53,000 crore after #Odisha iron ore miners paying Rs 19,000 core http://www. ecoti.in/WJBDyZ via @economictimes",0.34
49,2019-05-09 07:45:00,16,43,A surplus on the volatile iron ore is all Aust has at present. Nothing else to hold off a recession. https:// twitter.com/JohnSaunders88 8/status/1169559121688809472 …,-0.4215
51,2019-04-09 07:43:00,35,106,"Nigeria is Africa's largest economy, largest oil, cement producer. Has Africa's largest gas reserves, 2nd largest iron ore , coal reserves, largest rice mill, 3rd largest foreign reserves, 2nd biggest banking sector. No. 3 investment destination. We are a powerhouse in Africa.",-0.29600000000000004
52,2019-03-09 08:54:00,31,54,"Mining is the strongest performer in the 2nd quarter. Main contributors to the 3.1% positive growth in the sector include iron ore , manganese & coal. Mining is about a number of minerals that we must protect & position ourselves to play our role in the economy. #StatsSA @DMR_SA pic.twitter.com/aZ5xo6ZnfG",0.9246
54,2019-02-09 11:41:00,906,5493,"As the granddaughter of an iron ore miner and the daughter of a union teacher and a union newspaperman, I know that our workers and our unions are the backbone of this nation. On this Labor Day, let’s make sure the next President stands up for American workers.",0.3182
55,2019-02-09 00:43:00,28,80,"#China ’s #IronOre futures rebounding for 2nd straight day, surging 5.6% for now pic.twitter.com/S9DWSe9CEH",0.2263
57,2019-08-30 07:18:00,40,198,"Found the base of the 13th century shaft furnace today with @SMLarchaeology . Used for smelting iron ore , it would orginally have looked something like this (second image via https://www. haraldthesmith.com/iron-smelting- part-iv-furnace-design/ … ) pic.twitter.com/OROmUpqy6z",0.3612
58,2019-08-30 03:20:00,39,74,"#OnThisDay 1984. Striking miners from four pits in the Gwent Valley, South Wales, seized a transporter bridge at Newport. The miners attempted to block supplies of iron ore and coal to British Steel’s strip mill at Llanwern by blocking the movement of ships.",-0.6705
59,2019-08-29 15:06:00,4,69,And continued to sell iron ore to the Germans - oh and let the Germans use trains to transport their troops to invade Norway and refused to give the Norwegian royal family refuge,-0.29600000000000004
60,2019-08-29 14:27:00,78,1107,"Guess where Sweden was during WWII when we were fighting literal fascism? Selling iron ore to Germany, who were completely dependent on it. So there goes that narrative.",-0.3612
61,2019-08-29 14:22:00,47,435,"Fun fact: Germany was heavily dependent on Sweden's iron ore during WWII while we were trying to defeat the literal Nazis. So tell me more about fighting fascism""""",-0.3566
62,2019-08-25 05:04:00,5,28,"MANDALORIAN IRON, also known as BESKAR, was an extremely durable iron ore only found in world of Mandalore and its moon, Concordia. Mandalorians Mandalore mined their planet for beskar, using it in the creation of weapons, armor, and starships (continued) pic.twitter.com/Ie8WpwLy2V",-0.2023
63,2019-08-23 06:13:00,96,104,"#CNBCTV18Exclusive Watch our MD V R Sharma, who was on @CNBCTV18Live earlier today to discuss about Angul ramps up, iron ore availabilities, our debt reduction plans and many more important issues. pic.twitter.com/2LMtj4AqcK",-0.1045
64,2019-08-23 00:04:00,15,40,"When Norway found oil & gas in the early seventies the principle of who owns the resources (that'll be the the people) was well established and uncontested, unlike in Oz where Lang Hancock could fly over the Pilbara, discover iron ore and say I'll have all of that, thank you"".""",0.5574
65,2019-08-22 11:43:00,15,17,"With the melting ice, #Greenland 's vast quantities of metals and energy resources—believed to include iron ore , lead, zinc, diamonds, gold, copper, uranium and oil—are becoming more accessible than ever before."" https://www. forbes.com/sites/davidnik el/2019/08/16/whats-so-great-about-greenland-why-trump-wants-it-and-why-denmark-wont-sell/#4eb008f3f8ed …""",0.2732
66,2019-08-22 07:53:00,21,43,I’m speechless. A joke? “It can’t be ignored that Australian iron ore exports could potentially be then used to support warship production.” Chinese military: Security experts fear Australian iron ore being used for Chinese submarines | Herald Sun https://www. heraldsun.com.au/news/experts-f ear-aussie-steel-being-used-for-chinese-submarines/news-story/b48a698f5bc0be57e124df8bee196dfe …,0.0258
67,2019-08-22 07:12:00,37,68,"Further signs of slowdown: Iron ore prices slumped to their lowest levels since March, part of a wider 30% slump this month (FT) Copper futures fell in New York for four of the past five months. Aluminium weakness signals persistent overcapacity. pic.twitter.com/5CTXLGUdX1",-0.6597
68,2019-08-22 03:51:00,12,26,"Don't let Venture Minerals play dice with takayna /Tarkine. In a move that smacks more of manipulating permits, Venture Minerals has announced decision to commence mining at Riley Creek despite three straight weeks of plummetting iron ore prices. http:// bobbrown.org.au/mr_220819 #politas",-0.2604
70,2019-08-21 13:23:00,12,45,"Hon'ble Mines tribunal, Govt. of India issues stay order against Karnataka Govt's decision about withdrawal of extension of mining lease of NMDC's Donimalai Iron ore mine & to conduct auction of that rich deposit. A welcome step for responsible mining. @SteelMinIndia @baijendra",0.8402
71,2019-08-21 12:44:00,98,424,"My theory is that he & his family want Greenland in order to get the jump on buying up valuable resources now becoming available as the ice melts– iron ore , lead, zinc, diamonds, gold, rare earth elements, uranium and oil. https://www. washingtonpost.com/politics/2019/ 08/21/trump-goes-full-parody-buying-greenland/ …",0.5267
72,2019-08-21 06:07:00,35,46,"Shock of the day - iron ore price takes another leg down. (62% down at $91 [-3.2%] from $120 at end July.) Fall not a surprise. Producers holding up well. Also 8 stocks that have lost more than 25% in Aug: Massmart, Aspen, Discovery, Mpact, Grindrod, Truworths, EOH & Steinhoff.",-0.5594
73,2019-08-20 12:48:00,33,34,". @TheLastRefuge2 Here’s BHP reason for supporting Globalization “BHP on Tues posted annual profit of $9.12 billion,a bumper figure built largely on selling iron ore , coal & copper to China,“ BHP chief to 'stick up for globalization' as trade tensions bite https:// mobile.reuters.com/article/amp/id USKCN1VA16R?utm_campaign=trueAnthem%3A%2BTrending%2BContent&utm_content=5d5c008a37ca340001cf7651&utm_medium=trueAnthem&utm_source=twitter&__twitter_impression=true …",0.4767
74,2019-08-20 09:17:00,143,740,"The Green New Deal!! Greenland is the world's largest island rich in oil, zinc, lead, iron ore , gold and diamonds! Home of Sirius Sled Dog Patrol"" an elite naval unit, the hardest special forces in the world to join!! The possibilities are endless. #GoGreen #GreenlandUSA pic.twitter.com/I5H9odZvBz""",0.8647
75,2019-08-20 07:20:00,22,41,Exclusive: Australia has warned it may cancel a China-backed mining company's permit to access its own iron ore mine which lies close to one of the nation's most highly sensitive defence sites https://www. smh.com.au/politics/feder al/australia-may-bar-china-backed-firm-from-a-mine-it-owns-on-a-missile-site-20190820-p52isk.html?utm_medium=Social&utm_source=Twitter#Echobox=1566293028 …,-0.5358
77,2019-08-16 12:36:00,13,44,"Greenland has many natural resources, including zinc, lead, gold, iron ore , heavy and light rare earth elements, copper and oil. Do you think this is a good idea? pic.twitter.com/6v6crx4Pzg",0.6597
78,2019-08-16 07:06:00,292,295,"Trump wants to buy Greenland? potential for many natural resources including zinc, lead, gold, iron ore , heavy & light rare earth elements, copper & oil China has made several efforts to gain an economic presence on the island, according to the report."" https:// portermedium.com/2019/08/report -trump-has-floated-the-idea-of-buying-greenland/ …""",0.7096
79,2019-08-14 13:38:00,7,71,"Look at Europe, where there's a much more robust safety net. You don't see endless bubbles or stock market speculation. Then look at China, which is much more precarious and has a precarious safety net. Bubbles after bubbles (real estate, iron ore , steel, stocks crypto etc.)",0.8338
80,2019-12-08 15:56:00,1524,1802,"A 2-MW windmill is made of 260tons of steel that required 300tons of iron ore & 170tons of coking coal, all mined, transported &produced by hydrocarbons A windmill could spin until it falls apart&never generate as much energy as was invested in building it pic.twitter.com/HdudrAxQL1",0.2732
81,2019-12-08 13:29:00,92,569,"After a hectic day touring various iron ore mines, it was refreshing to spend some time with these school children. SAIL is contributing towards education and wellbeing of children living around the mine area. My best wishes to these children for a bright future! pic.twitter.com/D2e1P8rPys",0.8398
82,2019-12-08 05:47:00,44,265,"Visited @SAILsteel ’s captive iron ore mine in Gua, Jharkhand. Impressed by the positivity of colleagues here. We discussed on a roadmap to enhance capacity of Gua iron ore mine to make it the best mine in the country both in production volumes and in sustainable mining. pic.twitter.com/PWTa1lb3h8",0.8909999999999999
83,2019-12-08 04:37:00,20,59,"- The construction sector is projected to shed 100,000 jobs by the end of 2019 - Retail remains in a recession"" - Iron ore has plummeted almost 30% in the last 2 weeks. - The chance of a global recession is as high as ~80% by the end of 2020. #TheSurplusIsToast #GiveUpScoMo""",-0.5574
84,2019-12-08 03:20:00,47,288,Visited @TataSteelLtd ’s Iron ore mines in Noamundi. Happy to know that Tata Steel has commissioned a solar power plant at the mines to reduce the carbon footprints. The solar power plant is a first to be set up in any iron ore mine of the country. pic.twitter.com/CMmc3nk45q,0.5719
85,2019-12-08 01:18:00,24,30,"Iron ore sank toward $80 a ton, extending this month’s rout, after China poured fuel on demand fears https:// bloom.bg/31tsR3K",-0.5106
86,2019-12-08 00:21:00,30,45,"#China ’s #IronOre futures extend losses on Monday, tumbling 4.7% to hit NEW LOW in nearly three month on downbeat outlook for demand and rising stockpiles. https://www. yuantalks.com/chinas-iron-or e-futures-two-month-low-as-turning-point-in-supplies-emerges/ … pic.twitter.com/xjmGSMMLUC",-0.6523
90,2019-09-08 09:50:00,31,80,"Shabaash @BSYBJP ಶಭಾಷ್! - Open Fire on Farmers - Allow Loot of Iron Ore - Go Missing while Half of Karnataka is drowning in floods Now, Order Lathi Charge on Flood Victims! ಅನ್ನ ಬೇಡಿ ಬಂದ ನಿರಾಶ್ರಿತರ ಮೇಲೆ ಲಾಠಿ ಚಾರ್ಜ್ ನಡೆಸಿದ ನಿಮ್ಮಂತಹವರನ್ನು ಆ ಭಗವಂತ ನೋಡಿಕೊಳ್ಳಲಿ! pic.twitter.com/bJ9N1Bo7oi",-0.7074
92,2019-07-08 04:23:00,14,32,"#China ’s #IronOre futures close 5% down to the lowest in over 2 months, limit down intraday. #CrudeOil futures down 2.4%. pic.twitter.com/m7ceLU9xia",-0.3818
94,2019-06-08 08:19:00,15,30,"Kaboom! Iron ore hit again. MBIOI-58 -1.8% to $86.34 MBIOI-62 -3% to $97.55 MBIOI-65-BZ -3.4% to $106.70 Now down 20.4%, 22.4% and 19.8% respectively from the recent cyclical highs #bearmarket pic.twitter.com/pyE0c7LSWP",0.4003
98,2019-05-08 08:06:00,23,49,"Iron ore walloped again, especially lower grades. MBIOI-58 -15.9% to $87.88 MBIOI-62 -6.7% to $100.56 MBIOI-65-BZ -6.5% to $110.50 The decline for 58% fines was the largest since daily spot pricing began in 2013. All 3 grades sit at multi-month lows. pic.twitter.com/yhPmshK754",-0.5095
99,2019-05-08 04:02:00,11,20,"It does look like the unsustainable rise in iron ore prices was, well, unsustainable. Vale production is coming back & in a win for economics, rising supply relative to a given level of demand = lower prices How low will it go?",0.5574
100,2019-05-08 03:02:00,11,22,"Always consider buying the Right #Building Materials for your Construction purposes. It is always worth considering factors like Requirement, Costs, Durability & Availability. #KanaraTMT #TMTsteelbar #Construction #Tmts #steelfacts #ironore #SteelTruth pic.twitter.com/KOlCMXkt65",0.5267
101,2019-05-08 01:18:00,35,41,Iron ore futures collapse back below $100 as rout gathers pace https:// bloom.bg/2yCnao3 pic.twitter.com/1sN0rTB3Sg,-0.4939
102,2019-05-08 00:18:00,124,200,Shock of the day: Rand at 14.86 to dollar. China halts US agriculture imports. Equity markets tumbling - S&P500 futures down over 1%. To add to out woes iron ore price collapsing. Now below $100 on increasing supplies from Brazil and easing Chinese demand. Manic Monday.,-0.7351
104,2019-03-08 07:06:00,9,67,"Theory: 'Arry and Bert are at Ffarquhar Quarry all the tine because they now mine iron ore , so they're apways there collecting it and taking it to the ironworks. (I know it doesn't look like iron ore in the trucks but whatever) pic.twitter.com/ptlw6r8fg3",-0.1419
105,2019-03-08 06:43:00,330,586,"African Natural Resources and Mines signed a deal with Nigeria to invest $600million in iron ore and steel production. Their plant will also generate enough heat that will produce 34mw electricity,and supply from their kaduna plant. This is a major boost to our steel production. pic.twitter.com/C5gu9P8cJs",0.6369
106,2019-02-08 00:34:00,1059,1003,"#AndhraPradesh IFS officer Kallol Biswas who had earned fame after serving notices to Bellary mining king #GaliJanardhanReddy for alleged irregularities"" done by his Obulapuram Mining Corporation and encroaching forest land for illegal iron ore mining sacked by the centre. pic.twitter.com/w0VTC9TiEJ""",-0.1779
107,2019-01-08 01:03:00,62,61,"Since 2013, #Soros has spent $41.9 million financing #OpenBorders #NGOs & Liberal protest groups. He is currently sued by the state of Israel for $10 billion for orchestrating the African country of Guinea’s freezing of Israeli iron ore mining contracts! https://www. lifesitenews.com/news/billionai re-leftist-soros-pouring-more-money-into-lobbying-efforts …",-0.4003
2,2019-04-11 09:31:00,5103,17895,"Hi, Australian trade guy here. Our country is 14,000km from Europe and overwhelmingly exports iron ore , coal and gold, mostly to Asia. Unless ya'll have a secret desert full of minerals and a plan to tow yourselves to just under South East Asia, our model won't work for you. https:// twitter.com/darrengrimes_/ status/1180165166136221696 …",-0.128
5,2019-07-11 09:31:00,22,90,"#SierraLeone has cancelled the mining license of the iron ore miner, SL Mining. Mines minister Foday Rado Yokie told me it’s due to the company’s “noncompliance with their mining agreement”. The company denies the allegations saying it’s shocked & surprised by the decision.",-0.6369
8,2019-03-11 09:31:00,24,92,Iron Ore Polnareff for @Mulletburd who is amazing and keeps donating?? what the heck??? Thank you! pic.twitter.com/REGbnOb3fl,0.8202
10,2019-09-30 09:31:00,28,43,The world’s top iron ore exporter cut its outlook for global steel demand https:// bloom.bg/2nMzcJ1,-0.2023
13,2019-03-11 09:31:00,1,18,"Some of the main bears when prices were way lower have turned into bulls just as a gigantic and completely foreseeable construction bust begins with an already weak economy and as China devalues it’s currency, already sending coal and iron ore down 20% in just 2 months. pic.twitter.com/EN5q3jyobd",-0.6249
15,2019-10-01 09:31:00,2,11,GLOBAL CUES Global cues positive as US and Europe end positive Asia and SGX Nifty start positive Crude snaps 2 day drop; Rises 0.7% after 3% overnight drop LME Lead and Zinc up 3% while other base metals muted DCE Iron ore and Steel rebar rally,0.765
21,2019-09-25 09:31:00,2170,3025,"Greta a windmill is made of 260 tons of steel that required 300 tons of iron ore & 170 tons of coking coal, all mined transported & produced by hydrocarbons. A windmill could spin until it falls apart (as this 1 does) &never generates as much energy as was invested in building it pic.twitter.com/6LNAyTXcJd",0.2732
38,2019-12-10 09:31:00,15,38,"#ZIOC Amazing news! Hearing and seeing more evidence out of Brazzaville that an agreement was signed for the construction of the Pointe-Noire Special economic zone! This is a absolute game changer for @Zanaga_ Iron_Ore . Institutions will want in this very soon, don’t miss out",0.8664
45,2019-06-10 09:31:00,16,47,"$5.9 bn The value of Australia’s current account surplus, the first since 1975. Driven by booming exports of iron ore and coal, the number isn’t as great as it looks, given ***most it goes back out of the country to resources firms that are majority foreign owned***.",0.7783
50,2019-04-10 09:31:00,5,36,Interesting that while Australia will likely have ‘twin surpluses’ they are both heavily reliant on the same one thing - high iron ore prices #ausbiz https:// twitter.com/Brad_Setser/st atus/1169421751677308930 …,0.4939
69,2019-08-22 09:31:00,32,63,"Tammy Bruce: Greenland is rich in natural resources. They have iron ore , lead, zinc, diamonds... uranium, oil, but also rare earth elements. We rely on China for those, interestingly enough, & that has been an understated threat by China in the trade negotiations.",0.25
76,2019-08-20 09:31:00,17,44,"*BHP: SURPRISED BY STRENGTH OF CHINA'S END-USE STEEL DEMAND, CHINA IRON ORE PORT STOCKPILES MAY FALL FURTHER IN 2H #bullish",0.6523
89,2019-10-09 09:31:00,15,54,"If it was fought on economic lines, why did they win then? Lets face it Australia is an economic basket case under the LNP. They've destroyed manufacturing and rely on coal and iron ore sales.",-0.1779
91,2019-07-09 09:31:00,31,52,"We Only Needed A Trigger"" - Iron Ore Plunges Into Bear Market, Weak Demand Outlook https://www. zerohedge.com/news/2019-08-0 7/we-only-needed-trigger-iron-ore-plunges-bear-market-weak-demand-outlook …""",-0.5267
95,2019-05-09 09:31:00,23,52,Iron ore collapses into a bear market https:// bloom.bg/2Kumy9u,-0.29600000000000004
96,2019-05-09 09:31:00,14,26,"Iron ore is key reason behind Australia's record trade surplus. The value of iron ore exports is up almost 60% since the beginning of the year, with miners benefiting a great deal from higher prices #ausbiz pic.twitter.com/dkvlD1wNj3",0.7579
