username;date;retweets;favorites;text;geo;mentions;hashtags;id;permalink
GasPriceWizard;2018-09-27 16:54;11;28;"Flash Quiz: what country sells its oil @less than 1/2 the world price? WTI gets $72.22/barrel while Brent fetches $81.72. Today, the Canadian crude index stands at $38.64 with our main export, WCS at $30.07. ’s #1 export is worthless as global demand rises. Let that sink in";;@less;#1;"1045401249351438336";https://twitter.com/GasPriceWizard/status/1045401249351438336
CampbellGunn1;2018-09-27 14:41;136;244;"I see Brent crude is currently touching $82 a barrel. Seems the price of oil is only newsworthy when it's falling.";;;;"1045367723038052353";https://twitter.com/CampbellGunn1/status/1045367723038052353
charliebilello;2018-09-27 12:29;34;40;"Brent Crude Oil above $81 for the first time since Nov 2014, up 192% from its low in Jan 2016. $ BRENT pic.twitter.com/0NwgvvqPSO";;;;"1045334597477834753";https://twitter.com/charliebilello/status/1045334597477834753
payoff_ch;2018-09-27 08:01;0;1;"SIX Umsatzspitzenreiter: FL15BV @Vontobel_FP_CH Constant Leverage Certificate auf 15X Long Brent Crude Oil ... http:// payoff.ch/CH0370524503";;@Vontobel_FP_CH;;"1045267071263801345";https://twitter.com/payoff_ch/status/1045267071263801345
Schuldensuehner;2018-09-27 04:26;22;25;"Global stock mkts fall as Fed sticks to script & investors digested likelihood of more Fed rate hikes stretching into next year. Reports of Italian budget meeting delay add to jittery mood and weaken Euro. #Italy 's 10y yields rise to 2.93%, Brent oil jumps to highest since 2014. pic.twitter.com/JUnIYkmizb";;;#Italy;"1045213038087933952";https://twitter.com/Schuldensuehner/status/1045213038087933952
Reuters;2018-09-26 04:26;20;22;"Brent oil trades near four-year high, but U.S. crude retreats https:// reut.rs/2Ocs309";;;;"1044850721814970373";https://twitter.com/Reuters/status/1044850721814970373
stucam7771;2018-09-24 07:50;71;99;"The ( Brent ) oil price now over $80 dollars a barrel - the first time since November 2014. After disrupting oil supplies by ripping up the Iran deal, Trump relied on the Saudis increasing supply to reduce the price. They didn't... https://www. bbc.co.uk/news/topics/cm jpj223708t/oil …";;;;"1044177260478189568";https://twitter.com/stucam7771/status/1044177260478189568
MurtalaIbin;2018-09-24 07:14;22;27;"Just in : Brent crude rises to $81 a barrel, highest oil price since November 2014 | Major oil traders are talking about Brent crude spike to $100 a barrel in 4Q 2018 as OPEC signals less urgency to boost production & impact of U.S. sanctions on Iran.";;;;"1044168081222905856";https://twitter.com/MurtalaIbin/status/1044168081222905856
JKempEnergy;2018-09-24 06:55;32;61;"Eleven years ago ... On Monday 24 Sep 2007, Brent closed at $78.91 Three days later, Brent closed above $80 for first time ever on 27 Sep 2007 Within ten months, Brent had closed at all-time high of $146.08 on 3 Jul 2008 Oil price dynamics are highly non-linear ... https:// twitter.com/dmitryZ_reuter s/status/1044161215184994304 …";;;;"1044163336743657474";https://twitter.com/JKempEnergy/status/1044163336743657474
wenkennedy;2018-09-24 06:36;39;58;"Oil 's lively Monday... Brent hits 4-year high https:// bloom.bg/2Dy447w Traders see $100 coming https:// bloom.bg/2NCh5BE Julian Lee: OPEC is a dying star https:// bloom.bg/2QTpbnq Asian market on fire https:// bloom.bg/2xAyxfP Global benchmark revamped https:// bloom.bg/2xCQUAV pic.twitter.com/9vMJuEop0P";;;;"1044158652045824000";https://twitter.com/wenkennedy/status/1044158652045824000
spectatorindex;2018-09-24 06:04;909;1076;"BREAKING: Brent crude oil hits $81, highest price in four years.";;;;"1044150535908020224";https://twitter.com/spectatorindex/status/1044150535908020224
AFP;2018-09-24 06:00;52;22;"#BREAKING Brent oil jumps to four-year high near $81 a barrel pic.twitter.com/rsGtqpRNdx";;;#BREAKING;"1044149652159975425";https://twitter.com/AFP/status/1044149652159975425
JavierBlas;2018-09-24 05:31;100;78;"#BREAKING : Brent crude rises to $80.51 a barrel, highest #oil price since November 2014 | More on @TheTerminal #OOTT #SaudiArabia";;@TheTerminal;#BREAKING #oil #OOTT #SaudiArabia;"1044142376409690112";https://twitter.com/JavierBlas/status/1044142376409690112
business;2018-09-24 05:24;61;55;"Major traders are talking about $100 oil again... and Brent crude has passed $80 as OPEC signals less urgency to boost production https:// bloom.bg/2MYBaNl pic.twitter.com/Dpy4WPHGYi";;;;"1044140383645556736";https://twitter.com/business/status/1044140383645556736
DougChapmanSNP;2018-09-24 04:35;72;93;"We call it Scotland’s Oil rather than Brent Crude, but at $80 a barrel some of that revenue could be going to fund and support @scotgovhealth @scotgoveconomy @EducationScot instead of giving it away for nothing. https:// twitter.com/OilPriceHourly /status/1044104169441964032 …";;@scotgovhealth @scotgoveconomy @EducationScot;;"1044128262065201152";https://twitter.com/DougChapmanSNP/status/1044128262065201152
JavierBlas;2018-09-24 01:41;32;32;"Followed minutes later by a nearly as strong forecast from major #commodities trader @Trafigura : Brent #oil at $80 a barrel now; $90 by Christmas and potentially $100 by New Year | #OOTT #PlattsAPPEC";;@Trafigura;#commodities #oil #OOTT #PlattsAPPEC;"1044084493043163136";https://twitter.com/JavierBlas/status/1044084493043163136
JavierBlas;2018-09-24 01:39;97;94;"BOOM: Major #oil trading house Mercuria sees risk of Brent crude spike to $100 a barrel in 4Q 2018 due to impact of U.S. sanctions on #Iran and other outages | #OOTT #PlattsAPPEC More on @TheTerminal pic.twitter.com/zfxX4OhMqO";;@TheTerminal;#oil #Iran #OOTT #PlattsAPPEC;"1044083780300943367";https://twitter.com/JavierBlas/status/1044083780300943367
josch2012;2018-09-23 11:27;0;0;"Brent Crude Oil Chartanalyse KW38-39/18 - Brent scheitert wiederholt an der 80$ Marke - Folgt nun Ausbruch bis 85$ oder ein Test abwärts?? https:// rohstoff.boersentagebuch.eu/?p=1469";;;;"1043869491891982337";https://twitter.com/josch2012/status/1043869491891982337
spectatorindex;2018-09-19 09:48;231;378;"Brent oil price on 18th of September of year. 2013: $109 2014: $98 2015: $47 2016: $45 2017: $55 Now: $78.6";;;;"1042395091589971969";https://twitter.com/spectatorindex/status/1042395091589971969
staunovo;2018-09-18 06:06;20;40;"Saudi Arabia is now comfortable with Brent oil prices rising above $80 a barrel, at least in the short term, as the global market adjusts to the loss of Iranian supply from U.S. sanctions BBG #OOTT";;;#OOTT;"1041976861432197120";https://twitter.com/staunovo/status/1041976861432197120
Ole_S_Hansen;2018-09-18 06:05;27;35;"*SAUDI ARABIA IS SAID TO BE COMFORTABLE WITH BRENT OIL ABOVE $80 #oil #OOTT pic.twitter.com/bhyaUK3LHu";;;#oil #OOTT;"1041976616161894400";https://twitter.com/Ole_S_Hansen/status/1041976616161894400
charttec;2018-09-17 09:37;0;0;"Neue Wochenanalyse Brent Oil Future ICE (17.09.2018): https://www. charttec.de/html/analyse_s tart.php …";;;;"1041667531772051457";https://twitter.com/charttec/status/1041667531772051457
josch2012;2018-09-16 10:51;0;0;"Brent Crude Oil Chartanalyse KW37-38/18 - Anstieg erneut an 80$ gescheitert - Ausbruch >80$ oder Rücksetzer < 76$ ?? https:// rohstoff.boersentagebuch.eu/?p=1459";;;;"1041323743719698432";https://twitter.com/josch2012/status/1041323743719698432
PlattsOil;2018-09-12 09:15;33;35;". @HSBC warns lack of spare oil capacity could push Brent #crudeoil to $100/b as bank raises price forecasts for #benchmark through to 2020. Andrew Critchlow ( @baldersdale ) reports: http:// plts.co/Ykdr30lMUU4 pic.twitter.com/mMRWTIH7VS";;@HSBC @baldersdale;#crudeoil #benchmark;"1039849858549596161";https://twitter.com/PlattsOil/status/1039849858549596161
chigrl;2018-09-11 04:36;33;60;"#EmergingMarkets : Crude oil prices in local currency terms #Brent pic.twitter.com/cgoUCCVrDb";;;#EmergingMarkets #Brent;"1039417299491532800";https://twitter.com/chigrl/status/1039417299491532800
LukeGromen;2018-09-04 11:32;41;124;"CNY oil contract hit 14% share of the oil mkt in 4 mths; it took Brent contract 20 yrs to reach the same share. At this pace, it won’t be long until phys reality forces the western narrative on this contract to change. That’ll be an interesting moment. http:// FFTT-LLC.com";;;;"1036985287203868673";https://twitter.com/LukeGromen/status/1036985287203868673
chris1argus;2018-09-04 10:17;16;27;"#Brent crude #oil could revisit its Aug. 15 low of $70.30 a barrel within four weeks, says @Wangtaoreuters #WTI #gas #OOTT #OPEC #Dubai #Saudi #shale #Iran #Iraq https:// tmsnrt.rs/2ozkDWr pic.twitter.com/rGeYp7qdAS";;@Wangtaoreuters;#Brent #oil #WTI #gas #OOTT #OPEC #Dubai #Saudi #shale #Iran #Iraq;"1036966557950332929";https://twitter.com/chris1argus/status/1036966557950332929
chris1argus;2018-09-04 08:31;30;26;"#Brent crude #oil prices "are likely to average close to $70 next year as supply exceeds demand", says @Barclays "We see the risks to this price forecast as skewed to the upside due to geopolitical factors." #OOTT #Iran #Venezuela #Libya #OPEC #Saudi #shale #Texas #Permian #gas pic.twitter.com/2qxTu2n4QU";;@Barclays;#Brent #oil #OOTT #Iran #Venezuela #Libya #OPEC #Saudi #shale #Texas #Permian #gas;"1036939800291553280";https://twitter.com/chris1argus/status/1036939800291553280
Ole_S_Hansen;2018-09-04 07:58;14;25;"Brent and WTI crude #oil on a tear with momentum buyers chasing the market higher. Iran supply risks and Tropical Storm Gordon more than off-setting EM currency weakness and the risk of an imminent trade war escalation pic.twitter.com/EJVQvH7IbY";;;#oil;"1036931425533140993";https://twitter.com/Ole_S_Hansen/status/1036931425533140993
JavierBlas;2018-09-04 05:59;54;62;"Brent crude #oil rises above $79 a barrel as #Iran exports dry up. Last time Brent approached (and surpassed $80 a barrel), Trump started to tweet about #OPEC -- #OOTT";;;#oil #Iran #OPEC #OOTT;"1036901457541431296";https://twitter.com/JavierBlas/status/1036901457541431296
Schuldensuehner;2018-09-04 02:41;44;52;"Shanghai’s early success w/ its new oil market is beginning to threaten the duopoly of Brent and WTI. In 4 mths, the yuan-denominated crude futures contract has built a 7% share of global crude turnover. https://www. breakingviews.com/considered-vie w/shanghais-early-market-win-threatens-oil-duopoly/?SID=577fdc3ae9328bc7748b4f9d&h=e06e05cc290e72d46b806ddcaec40d4e&content_alert_status=Ready+Soon&utm_source=Sailthru&utm_medium=email&utm_campaign=Shanghai+oil+market%2C+New+Silk+Road+Tue%2C+04+Sep+2018+03%3A29+slam&utm_term=BV+-+Eikon#.W44ahIQ0oN0.twitter … pic.twitter.com/2vlzenhFKc";;;#;"1036851733488644096";https://twitter.com/Schuldensuehner/status/1036851733488644096
Ole_S_Hansen;2018-09-03 07:47;18;28;"Brent crude #oil has almost reached resistance at $78.5/b. Despite falling supply from Iran it may struggle in the s/t to break. This due to ongoing EM currency weakness and ahead of Thursday when Trump is expected to step up the #tradewar with China. #OOTT pic.twitter.com/XW9MYFEDXV";;;#oil #tradewar #OOTT;"1036566296572428288";https://twitter.com/Ole_S_Hansen/status/1036566296572428288
business;2018-09-03 03:46;23;24;"Brent oil struggles to gain as the prospect of Iran's supply cuts is offset by signs of higher output elsewhere https:// bloom.bg/2PZEgmY pic.twitter.com/oNGUlAFi6u";;;;"1036505593425657856";https://twitter.com/business/status/1036505593425657856
Reuters;2018-09-02 23:16;44;47;"Brent crude oil dips on rising OPEC output; looming sanctions on Iran prevent bigger fall https:// reut.rs/2NHdJJO pic.twitter.com/bjrGpXNfRi";;;;"1036437630190276608";https://twitter.com/Reuters/status/1036437630190276608
RobertADorrough;2018-09-02 19:34;6;28;"Venezuela has the largest proven Brent crude oil reserves in the world, 297.7 bbl. Some talking about doing what made America great, killing people to take their land and resources. Others say end oil addiction before it cooks us. Wonder who'd win a reason/science based debate.";;;;"1036381872035528704";https://twitter.com/RobertADorrough/status/1036381872035528704
josch2012;2018-09-02 08:30;0;0;"Brent Crude Oil Chartanalyse KW35-36/18 - Anstieg über 77$ - Test der 80$ oder Rückgang auf <75$ ?? https:// rohstoff.boersentagebuch.eu/?p=1438";;;;"1036214758335303680";https://twitter.com/josch2012/status/1036214758335303680
business;2018-08-31 03:11;13;14;"Brent crude is on course for a gain of nearly 5% this month, while U.S. oil is also set to advance https:// bloom.bg/2PQ2GPU pic.twitter.com/KIHTjPiM4y";;;;"1035409820550135808";https://twitter.com/business/status/1035409820550135808
ANI;2018-08-29 10:57;4;35;"I earnestly believe that this increase in oil prices in brent and crude oil is really temporary. The fluctuations coming in the crude had gone down to the level of 70 dollars per barrel in Dubai crude. It should be temporary: DEA Secretary Subhash Garg on increase in fuel prices pic.twitter.com/U35Bc7s5Xh";;;;"1034802316287913984";https://twitter.com/ANI/status/1034802316287913984
WolverinesJrA;2018-08-28 23:50;7;88;"Congratulations to @AndrewPeard on his new adventure with the oil kings, the best announcer in the business, we at the wolverines don't just promote our players. Best of Luck, Brent & Tracy Stark";;@AndrewPeard;;"1034634374723977218";https://twitter.com/WolverinesJrA/status/1034634374723977218
josch2012;2018-08-26 11:59;0;0;"Brent Crude Oil Chartanalyse KW34-35/18 - Kurs über 75$ - marschiert der Kurs bis 80$ oder abwärts bis 70$?? https:// rohstoff.boersentagebuch.eu/?p=1424";;;;"1033730692713197568";https://twitter.com/josch2012/status/1033730692713197568
Big_Orrin;2018-08-25 08:39;9;18;"Brexit could have a massive effect on the price of Dated Brent and Brent Futures. The UK without the trade agreements it has through the EU will become a 3rd Country under WTO rules meaning every country that is not the UK will place import tariffs on the oil the UK exports #OOTT";;;#OOTT;"1033318054707515392";https://twitter.com/Big_Orrin/status/1033318054707515392
JavierBlas;2018-08-24 02:40;38;45;"Brent crude #oil back above $75 a barrel. Physical market looking supportive with glut of WAF crude starting to dissipate amid Asian buying. #OOTT pic.twitter.com/zJ4wOAuV9b";;;#oil #OOTT;"1032865334016008192";https://twitter.com/JavierBlas/status/1032865334016008192
WingGirlTrade;2018-08-16 08:21;9;13;"OIL MARKETS edges up as China & U.S. set trade talks, but markets wary of slowing demand - Brent crude oil futures were at $71.11 per barrel -U.S. (WTI) crude futures were up 15 cents per barrel Both benchmarks lost more than 2 percent during the previous day's trading. pic.twitter.com/Gx3wGeAl8E";;;;"1030051821442805760";https://twitter.com/WingGirlTrade/status/1030051821442805760
streiffi11;2018-08-12 16:20;0;0;"Sonderbericht zu Brent Crude OIL http:// streiffi2.forumieren.com/t1136-sonderbe richt-zu-brent-crude-oil … via @streiffi1";;@streiffi1;;"1028722876176887808";https://twitter.com/streiffi11/status/1028722876176887808
Schuldensuehner;2018-07-30 16:34;25;17;"#Oil pares gains w/ Brent back below $75/bbl as US President Trump says he is willing to meet Iranian President Rouhani 'any time' w/o conditions. pic.twitter.com/FphRnVmcyz";;;#Oil;"1024015279284801536";https://twitter.com/Schuldensuehner/status/1024015279284801536
aroseblush;2018-07-30 14:31;49;43;"Yikes! Stock Market Falling Like a Stone on Bad TARIFF News Dow Down -94 points Nasdaq Down - 97 points However, Brent Oil Prices UP to $74.00. Awful for Americans. Also, anything in an aluminum can will cost you 2 cents more.";;;;"1023984343788781569";https://twitter.com/aroseblush/status/1023984343788781569
LIONSTRADE;2018-07-30 09:30;0;0;"#Singapurs #Offshore -Industrie erholt sich http:// reut.rs/2NW27lF #LIONSTRADE #Oil #Asia #WTI #Brent #crudeoil #Wirtschaft #Finanzen #Singapur #BIP #GDP #FinancialMarkets #Finance";;;#Singapurs #Offshore #LIONSTRADE #Oil #Asia #WTI #Brent #crudeoil #Wirtschaft #Finanzen #Singapur #BIP #GDP #FinancialMarkets #Finance;"1023908696047398912";https://twitter.com/LIONSTRADE/status/1023908696047398912
Ole_S_Hansen;2018-07-29 15:24;12;24;"Funds returned to Brent crude #oil and bought 14.4k lots as a war of words between Trump and Rouhani highlighted the continued risk of disruptions. WTI meanwhile was sold (-9.5k) leaving the combined change small up on the week #OOTT pic.twitter.com/yRRU7CmjoS";;;#oil #OOTT;"1023635333433446400";https://twitter.com/Ole_S_Hansen/status/1023635333433446400
josch2012;2018-07-29 12:07;0;0;"Brent Crude Oil Chartanalyse KW30-31/18 - Kurs wieder knapp im steigenden Trendkanal - Kursziel < 70$ oder >77$ ??? https:// rohstoff.boersentagebuch.eu/?p=1364";;;;"1023585696811044864";https://twitter.com/josch2012/status/1023585696811044864
JKempEnergy;2018-07-28 06:37;9;16;"HEDGE FUND net position changes in the week to Jul 24 Brent +14 million bbl WTI -11 million bbl Gasoline +11 million bbl Heating oil +12 million bbl Gasoil +11 million bbl";;;;"1023140447106031616";https://twitter.com/JKempEnergy/status/1023140447106031616
anasalhajji;2018-07-26 10:06;7;13;"For those on the #political side of the oil market who are exaggerating the impact of political events on the oil market & expecting massive increase in oil prices as a result: Saudi oil shipments through the Bab El Mandeb is halted, yet Brent went down! EXPLAIN! #oil #OOTT pic.twitter.com/oZ4GXaffMZ";;;#political #oil #OOTT;"1022468147012685829";https://twitter.com/anasalhajji/status/1022468147012685829
JavierBlas;2018-07-26 09:51;18;33;"The best evidence of the weak #oil market in full display today, with both WTI and Brent down despite #SaudiArabia suspending shipments through the mouth of the Red Sea. #OOTT";;;#oil #SaudiArabia #OOTT;"1022464454972329984";https://twitter.com/JavierBlas/status/1022464454972329984
aeberman12;2018-07-26 09:10;12;25;"OPEC oil-directed rig count stopped declining when Brent rose above $45 per barrel: a signal that markets may have taken to approximate OPEC break-even price. #OOTT #oilandgas #oil #WTI #CrudeOil #fintwit #OPEC pic.twitter.com/tzTEpGRc8h";;;#OOTT #oilandgas #oil #WTI #CrudeOil #fintwit #OPEC;"1022454098715652096";https://twitter.com/aeberman12/status/1022454098715652096
GasPriceWizard;2018-07-24 23:54;185;216;"And now Canadian oil (WCS) is selling for $36 a barrel while the world gets $68(WTI) to $73 ( Brent ) a barrel. Whither Canada ? .... https:// twitter.com/premierscottmo e/status/1021778647777247232 …";;;;"1021951892409266178";https://twitter.com/GasPriceWizard/status/1021951892409266178
WingGirlTrade;2018-07-24 08:25;9;16;"Oil prices steadied on Tues as rising tension between U.S. and Iran highlighted risks to supply while escalating trade disputes raised prospect of weaker energy demand. - Brent crude oil was unchanged at $73.06 a barrel by 0840 GMT. - U.S. light crude was up 15 cents at $68.04. pic.twitter.com/jJxNdxtzHn";;;;"1021717918353182720";https://twitter.com/WingGirlTrade/status/1021717918353182720
charttec;2018-07-23 16:19;0;0;"Neue Wochenanalyse Brent Oil Future ICE (23.07.2018): https://www. charttec.de/html/analyse_s tart.php …";;;;"1021474901256019968";https://twitter.com/charttec/status/1021474901256019968
alexlongley1;2018-07-23 12:59;12;34;"For today's edition of `what's-a-tumblin' in the oil market?' I offer the prompt Brent spread #OOTT pic.twitter.com/ZD9ZLsd29s";;;#OOTT;"1021424632191123465";https://twitter.com/alexlongley1/status/1021424632191123465
Ole_S_Hansen;2018-07-23 08:56;104;114;"Seventeen weeks after being launched China's petro-yuan continues to take market share from Brent and WTI crude #oil . Despite its much shorter trading hours (9.5 vs 23) the four-week average market share rose above 11% last week. #OOTT pic.twitter.com/Pb1CxkerEz";;;#oil #OOTT;"1021363386817433600";https://twitter.com/Ole_S_Hansen/status/1021363386817433600
BeyondTheTrades;2018-07-23 08:28;8;15;"Oil prices stabilized on Monday as worries over production losses were outweighed by concerns that trade disputes would reduce economic growth and hit global energy demand. - Brent crude was up 15 cents at $73.22 a barrel by 0750 GMT. - U.S. light crude was unchanged at $68.26. pic.twitter.com/cHm9eolMOa";;;;"1021356295948062721";https://twitter.com/BeyondTheTrades/status/1021356295948062721
josch2012;2018-07-22 11:06;0;0;"Brent Crude Oil Chartanalyse KW29-30/18 - Brent exakt bei 73$ - Kursziel <68$ oder ~77$ ?? https:// rohstoff.boersentagebuch.eu/?p=1356";;;;"1021033779501109248";https://twitter.com/josch2012/status/1021033779501109248
Ole_S_Hansen;2018-07-22 10:20;16;19;"Brent Crude #oil bounced off the support level mentioned in our recently published Q3 outlook. Looking for a minimum recovery to between $75.3 and $76.3/b. #OOTT pic.twitter.com/jwdlhk4EQ8";;;#oil #OOTT;"1021022218850127872";https://twitter.com/Ole_S_Hansen/status/1021022218850127872
KimbleCharting;2018-07-17 10:50;19;14;"Brent Oil futures testing important support after dual resistance held 10-weeks ago. $ CL_F $ USO $ SPY $ XLE $ XOP pic.twitter.com/oYLmk6Cjp4";;;;"1019217870738411521";https://twitter.com/KimbleCharting/status/1019217870738411521
Reuters;2018-07-17 10:08;14;27;"Brent crude oil hits three-month low as output rises https:// reut.rs/2Jx64uz pic.twitter.com/fWhJRGtLWn";;;;"1019207221702471680";https://twitter.com/Reuters/status/1019207221702471680
PlattsOil;2018-07-17 00:19;8;12;"Crude oil futures stabilize ahead of US inventory data. At 10:45 am SGT: - ICE Sep Brent crude futures at $72.28/b - NYMEX Aug light sweet crude contract at $68.08/b http:// plts.co/QoKZ30kZ2cO";;;;"1019058974014963714";https://twitter.com/PlattsOil/status/1019058974014963714
altii_news;2018-07-05 06:25;0;0;"Nach einem Anstieg auf über 80 USD pro Barrel am 22. Mai 2018 fällt der Brent -Ölpreis wieder, so Nitesh Shah, @ETF_Securities . Ist die #OPEC mit ihren Drosselungen zu weit gegangen? https://www. altii.de/market-stateme nts/2397/opec-signalisiert-bereitschaft-fur-erhohung-der-fordermenge/?pk_campaign=tw&pk_kwd=mm_ETFS_OPEC … #oil #oilprice pic.twitter.com/BkDkpb7SGS";;@ETF_Securities;#OPEC #oil #oilprice;"1014802313834323969";https://twitter.com/altii_news/status/1014802313834323969
chris1argus;2018-07-04 07:59;34;28;"#Iran Revolutionary Guards Commander #Soleimani says ready to prevent regional #oil exports if Iranian oil sales are banned - @Reuters #OPEC #OOTT #Saudi #Iraq #Qatar #Bahrain #Kuwait #gas #UAE #Yemen #Trump #Israel #missiles #sanctions #Brent #Rouhani pic.twitter.com/8R6oMRGIBG";;@Reuters;#Iran #Soleimani #oil #OPEC #OOTT #Saudi #Iraq #Qatar #Bahrain #Kuwait #gas #UAE #Yemen #Trump #Israel #missiles #sanctions #Brent #Rouhani;"1014463759061082119";https://twitter.com/chris1argus/status/1014463759061082119
LIONSTRADE;2018-07-03 11:40;0;0;"#WTI knackt seit 2014 zum ersten Mal die 75 #USD -Marke! #LIONSTRADE #Oil #Öl #Brent #Marktanalyse #Ölpreis #Rohstoffe #Commodities #Trading #Börse #Finanzen #Wirtschaft";;;#WTI #USD #LIONSTRADE #Oil # #Brent #Marktanalyse # #Rohstoffe #Commodities #Trading #B #Finanzen #Wirtschaft;"1014156866862112768";https://twitter.com/LIONSTRADE/status/1014156866862112768
thabileoka;2018-07-03 11:35;34;51;"How should the petrol price be reduced? Bare in mind that the recent increase in the fuel levy is lower than previous increases and fuel prices are mainly determined by the international price of brent crude oil and movements in the rand exchange rate. So what should give?";;;;"1014155772081639425";https://twitter.com/thabileoka/status/1014155772081639425
chris1argus;2018-07-03 07:50;105;89;"Morgan Stanley raises forecasts for #Brent crude #oil by $7.5/barrel to $85 as it cuts projections for supply from #Iran #Angola and #Libya but raises estimates for #Saudi Arabia #OPEC #OOTT @MorganStanley #gas #Trump #sanctions #nuclear #WTI pic.twitter.com/CviYk2mpoO";;@MorganStanley;#Brent #oil #Iran #Angola #Libya #Saudi #OPEC #OOTT #gas #Trump #sanctions #nuclear #WTI;"1014099061727690753";https://twitter.com/chris1argus/status/1014099061727690753
payoff_ch;2018-07-02 08:01;0;0;"SIX Umsatzspitzenreiter: TCOCI @UBS Tracker Certificate auf UBS Bloomberg CMCI Brent Crude Oil TR Index (USD) http:// payoff.ch/CH0032661685";;@UBS;;"1013739344140623873";https://twitter.com/payoff_ch/status/1013739344140623873
InvestorSMS;2018-07-02 05:31;0;0;"Brent Crude Oil : Rasant an die 80 Dollar-Marke – und darüber hinaus? | InvestorSMS http:// ow.ly/CYHu50hS5pn";;;;"1013701601436078080";https://twitter.com/InvestorSMS/status/1013701601436078080
JavierBlas;2018-06-29 07:35;44;35;"Brent crude #oil fast heading to $80 a barrel again -- #OOTT pic.twitter.com/RDmTzzMHyO";;;#oil #OOTT;"1012645821974708224";https://twitter.com/JavierBlas/status/1012645821974708224
JavierBlas;2018-06-27 12:56;15;30;"CHART OF THE DAY: WTI crude #oil surges to fresh 3½-year high above $73 a barrel. Brent rises above $78 a barrel. #OOTT #OPEC pic.twitter.com/uNCxcu5qvn";;;#oil #OOTT #OPEC;"1012001706916409345";https://twitter.com/JavierBlas/status/1012001706916409345
anasalhajji;2018-06-27 12:37;17;39;"Just to be clear, when spare production capacity is LOW, YOU WILL KNOW. Because Brent will be above $120/b by then. For now... it is all about economics, politics, and technical issues. "When spare is low, you will know' #oil #OPEC #SaudiArabia pic.twitter.com/FqpXdZBQNG";;;#oil #OPEC #SaudiArabia;"1011996937703317505";https://twitter.com/anasalhajji/status/1011996937703317505
JavierBlas;2018-06-27 11:56;20;28;"Brent rises to $78 a barrel WTI #oil nears $73 a barrel #OOTT #OPEC";;;#oil #OOTT #OPEC;"1011986601981960194";https://twitter.com/JavierBlas/status/1011986601981960194
lesourdalain75;2018-06-26 09:11;0;0;"alainlesourd-45: Kompass (Gipfeltreff auf der Schamgrenze) Kati Heck 2013-14 Oil On Canvas (via Brent ... https:// tmblr.co/ZMvg9e2ZEwZYX";;;;"1011582772031442944";https://twitter.com/lesourdalain75/status/1011582772031442944
