username;date;retweets;favorites;text;geo;mentions;hashtags;id;permalink
dmightyangel;2018-04-12 14:00;33;33;"As at today, Brent crude oil is $71.7 per barrel..... As at today, Nigeria Reserve is above $47B So @OfficialPDPNig listen to this special song sent to you by @Mr_JAGs pic.twitter.com/KtGZI55NEf";;@OfficialPDPNig @Mr_JAGs;;"984476446809837568";https://twitter.com/dmightyangel/status/984476446809837568
spectatorindex;2018-04-12 09:01;435;420;"Brent Crude oil price. Two years ago: $42.3 One year ago: $55.9 One month ago: $64.9 Now: $71.7";;;;"984401104174592000";https://twitter.com/spectatorindex/status/984401104174592000
dmightyangel;2018-04-12 06:26;28;36;"Just 48 hours after President Buhari's 2nd term intention was announced, brent crude oil gained momentum and rose to $71.4 per barrel.... This Buhari sef #TweetLikeThem #PMBdeclares";;;#TweetLikeThem #PMBdeclares;"984362234641092609";https://twitter.com/dmightyangel/status/984362234641092609
chigrl;2018-04-11 18:44;22;54;"Brent Oil Price & US Dollar – Ruble Exchange Rate #oott pic.twitter.com/R7luO7H6yV";;;#oott;"984185473315868672";https://twitter.com/chigrl/status/984185473315868672
joshdcaplan;2018-04-11 13:21;31;26;"CNBC: Oil prices go boom, spike to three-year high with brent crude at $73.09 amid potential strike on Syria";;;;"984104093647036416";https://twitter.com/joshdcaplan/status/984104093647036416
spectatorindex;2018-04-11 07:49;269;225;"BREAKING: Brent crude oil price hits $71.4, the highest price in over three years.";;;;"984020585696120832";https://twitter.com/spectatorindex/status/984020585696120832
Schuldensuehner;2018-04-10 17:38;39;41;"Brent crude hit its highest levels in over three years as Saudis want $80/bbl oil ahead of Aramco IPO. pic.twitter.com/MsLRzQNUve";;;;"983806511091773442";https://twitter.com/Schuldensuehner/status/983806511091773442
JavierBlas;2018-04-10 17:24;13;18;"Brent crude #oil closes up 3.6% (+$2.44) a barrel today (that's the biggest intraday % gain in ~6 months) #OOTT https://www. bloomberg.com/news/articles/ 2018-04-10/saudi-arabia-is-said-to-signal-ambition-for-80-oil-price …";;;#oil #OOTT;"983802932159303681";https://twitter.com/JavierBlas/status/983802932159303681
jsblokland;2018-04-10 16:41;9;9;"#Brent #oil rises to the highest level of the year! #inflation pic.twitter.com/pyn0KapMf4";;;#Brent #oil #inflation;"983792097290608642";https://twitter.com/jsblokland/status/983792097290608642
BBoason;2018-04-10 11:42;91;81;"BREAKING: Brent crude oil back at $70.09pb up some 1.05% today";;;;"983716908645212160";https://twitter.com/BBoason/status/983716908645212160
charttec;2018-04-09 17:55;0;0;"Neue Wochenanalyse Brent Oil Future ICE (09.04.2018): https://www. charttec.de/html/analyse_s tart.php …";;;;"983448288111333377";https://twitter.com/charttec/status/983448288111333377
Vontobel_FP_DE;2018-04-09 13:05;0;0;"#Brent #Crude #Oil : Letzte Chance für Trendwende. Kolumne von Maciej Gaj: https:// zertifikate.vontobel.com/DE/blog/Artike l/brent-crude-oil-letzte-chance-f-r-trendwende … #StrukturierteProdukte #Commodities #Trump #Börse #Trading pic.twitter.com/LfMe4VMPaV";;;#Brent #Crude #Oil #StrukturierteProdukte #Commodities #Trump #B #Trading;"983375234144325632";https://twitter.com/Vontobel_FP_DE/status/983375234144325632
desertfox61I;2018-04-09 04:20;41;32;"Facts Brent crude oil price rose by 24 % from $46.37 to $57.51 per barrel. Price of petrol in Delhi rose by a mere 5.93 % from Rs 64.55 per litre to Rs 68.38 per litre & diesel by just 5.43 % from Rs 53.96 per litre to Rs 56.89 per litre. http://www. dailypioneer.com/columnists/ope d/criticism-will-not-change-fuel-price-rise.html … @Sanju_Verma_";;@Sanju_Verma_;;"983243320083169280";https://twitter.com/desertfox61I/status/983243320083169280
josch2012;2018-04-08 13:21;0;0;"Brent Crude Oil Chartanalyse KW14-15/18 - Kurs knapp unter 67$ - Kursziel 65$ oder > 70$ ?? https:// rohstoff.boersentagebuch.eu/?p=1232";;;;"983017074342662146";https://twitter.com/josch2012/status/983017074342662146
Ole_S_Hansen;2018-04-08 08:11;15;13;"Funds made only a small adjustment to the record Brent crude #oil long ahead of the weakness that followed China’s retaliatory opening shot against US tariffs last Wednesday. The combined net-long in WTI and Brent stayed above 1 million lots. #OOTT pic.twitter.com/0rfDauMWIC";;;#oil #OOTT;"982939067762593792";https://twitter.com/Ole_S_Hansen/status/982939067762593792
HayekAndKeynes;2018-04-06 19:36;74;174;"Texas is pumping so much oil pipelines are now full (~96% for the last four weeks according to Genscape). Midland (Permian) now trades at a $10 discount to Brent . The ability to physically move oil & not the ability to drill for it may limit US production. Slightly bullish. pic.twitter.com/QMetbF4Sew";;;;"982386577757401088";https://twitter.com/HayekAndKeynes/status/982386577757401088
spectatorindex;2018-04-04 03:42;235;294;"Brent crude oil price. Five years ago: $104 One year ago: $54 One month ago: $65 Now: $68";;;;"981421751111438336";https://twitter.com/spectatorindex/status/981421751111438336
SalahBouhmidi;2018-04-03 12:01;0;0;"#USDCAD : 1,29 CAD bleibt weiterhin ein Hindernis http:// bit.ly/2H5Of6l #Loonie #CAD #Kanada $ USDCAD #Dollar #DXY #tariffs #Trump #WTI #Brent #OPEC #Oil #Petrol #DailyFX pic.twitter.com/dweXNQ9QDw";;;#USDCAD #Loonie #CAD #Kanada #Dollar #DXY #tariffs #Trump #WTI #Brent #OPEC #Oil #Petrol #DailyFX;"981184989747441665";https://twitter.com/SalahBouhmidi/status/981184989747441665
MWTrackChaser;2018-04-01 23:34;0;0;"Lucas Oil MLRA Late Models: 1) Chris Simpson ($15,000) 2) Rusty Schlenk 3) Ricky Weiss 4) Chad Simpson 5) Brian Shirley 6) Shannon Babb 7) Mike Spatola 8) Dennis Erb Jr. 9) Brent Larson 10) Mason Oberkramer 11) Jose Parga 12) Ryan Unzicker 13) Rob Tolan… https:// ift.tt/2pWliBN";;;;"980634626111803392";https://twitter.com/MWTrackChaser/status/980634626111803392
TankerTrackers;2018-04-01 17:35;14;20;"PERSPECTIVE: In September 2017, the KRG exported 550Kbpd, generating a revenue of $751M (based on $12 discount to Brent oil ). In March 2018, they exported 41% fewer barrels, but generated $586M (-22%) in sales due to the higher barrel price. #OOTT pic.twitter.com/WBMf7AzyiD";;;#OOTT;"980544294057598977";https://twitter.com/TankerTrackers/status/980544294057598977
chigrl;2018-03-30 17:45;11;45;"So, Im finally picking apart the gazillion pages of regulations in this China oil contract..basically..you can trade this contract just as you could if you were trading Brent or WTI with foreign funds.";;;;"979821867077980160";https://twitter.com/chigrl/status/979821867077980160
JavierBlas;2018-03-30 05:16;14;16;"Despite Brent hitting $70 a barrel, equity investor apathy toward the #oil sector remains strong -- via @energyintel ($$$) #OOTT https://www. energyintel.com/Pages/Eig_Arti cle.aspx?DocID=994104&utm_campaign=top-story&utm_medium=site&utm_source=1&utm_content=Oil+Industry+Pleads+for+Investor+Attention-994104&ts=1 …";;@energyintel;#oil #OOTT;"979633555474145280";https://twitter.com/JavierBlas/status/979633555474145280
JavierBlas;2018-03-28 19:35;10;13;"WTI and Brent #oil nearby time-spreads diverging. Brent in strong backwardation (feels like a pre-expiry squeeze) while WTI flirts again with contango. #OOTT";;;#oil #OOTT;"979124763284078592";https://twitter.com/JavierBlas/status/979124763284078592
lionelbarber;2018-03-27 03:07;12;8;"This is a big bold move by China on back of other market moves (cf launching renminbi oil figures to rival Brent and West Texas benchmarks) https:// twitter.com/gabewildau/sta tus/978507856222633984 …";;;;"978513735399739392";https://twitter.com/lionelbarber/status/978513735399739392
MEGAVUCA;2018-03-23 15:50;10;19;"Brent oil over$70?Surely not?Has not the special magic of the Permian capped global oil price at er...$20/40 , sorry $50, well how about $55 er..65?Lower for longer delayed til 2019 due to situational geopolitics? In VUCA world I am afraid geopolitics and sharp swings are endemic pic.twitter.com/v0oVlY9OcP";;;;"977256361636614144";https://twitter.com/MEGAVUCA/status/977256361636614144
Convertbond;2018-03-21 18:10;8;24;"March FOMC Meeting* Gold Miners +2.8% 2 Year Treasuries: -4bps 2s 10s: +5.2% Brent Oil : +3.5% Nasdaq 100: -0.50% Dollar: -0.95% 2018 Dots: Unched 2019 Dots: +19bps 2020 Dots: +31bps *Extremely dovish relative to sky-high expectations";;;;"976566796680654848";https://twitter.com/Convertbond/status/976566796680654848
Convertbond;2018-03-20 09:54;6;15;"Brent Trend Breakout #Oil #Iran #GeopoliticalRisk pic.twitter.com/tYaSBnV81s";;;#Oil #Iran #GeopoliticalRisk;"976079443138629632";https://twitter.com/Convertbond/status/976079443138629632
JaroGiesbrecht;2018-03-19 15:12;25;16;"Notorious #Russiantrollfarm targeted @JustinTrudeau , #Canadianoil in online campaigns #oil #opec #iea #aboil #usoil #wti #shale #OOTT #brent #crude #energy #Cdnpoli https://www. thestar.com/news/canada/20 18/03/18/notorious-russian-troll-farm-targeted-trudeau-canadian-oil-in-online-campaigns.html …";;@JustinTrudeau;#Russiantrollfarm #Canadianoil #oil #opec #iea #aboil #usoil #wti #shale #OOTT #brent #crude #energy #Cdnpoli;"975797253360123904";https://twitter.com/JaroGiesbrecht/status/975797253360123904
anasalhajji;2018-03-18 23:57;16;17;"We will likely see an increase in #oil exports form some OPEC members in March, April, and May, but that level of exports cannot be maintained between June and September as domestic consumption in most oil-producing countries increases in the summer months. #OOTT #OPEC #Brent pic.twitter.com/M4BCoFrRzy";;;#oil #OOTT #OPEC #Brent;"975566780352647168";https://twitter.com/anasalhajji/status/975566780352647168
josch2012;2018-03-18 12:51;0;0;"Brent Crude Oil Chartanalyse KW11-12/18 - Ausbruch knapp geglückt - Rückfall oder Trendfortsetzung über 67$? https:// rohstoff.boersentagebuch.eu/?p=1199";;;;"975399369678651394";https://twitter.com/josch2012/status/975399369678651394
Reuters;2018-03-16 18:24;27;27;"Oil prices jump, Brent hits highest in more than 2 weeks http:// reut.rs/2HF00jg pic.twitter.com/o2IEmu0heB";;;;"974758207796236288";https://twitter.com/Reuters/status/974758207796236288
biedexcom;2018-03-16 04:54;0;0;"( BRENT ÖL-Tagesausblick - Kursausbruch bleibt abzuwarten) - http://www. tradebuddy.online/wp-content/upl oads/2018/03/2598043.png … - Brent Crude Oil Future Kursstand: 65,03 USD Intraday Widerstände: 65,40+66,00+67,05+67,82  Intraday Unterstützungen: 63,... - http://www. tradebuddy.online/brent-ol-tages ausblick-kursausbruch-bleibt-abzuwarten/ … pic.twitter.com/bXpCYB4h89";;;;"974554477016506368";https://twitter.com/biedexcom/status/974554477016506368
godmodetrader;2018-03-15 04:00;1;0;"DZ BANK – #Brent Crude Oil – Pullback wird gekauft! #wirtschaft #finanzen http:// gmtr.ly/4koztbXKV";;;#Brent #wirtschaft #finanzen;"974178424871940098";https://twitter.com/godmodetrader/status/974178424871940098
JavierBlas;2018-03-13 16:17;11;14;"Brent crude #oil nearby time-spreads also coming under pressure (after WTI flips into contango). Chart is Brent May-June (K8-M8) spread -- #OOTT pic.twitter.com/NVP4lqG2FU";;;#oil #OOTT;"973639251110883329";https://twitter.com/JavierBlas/status/973639251110883329
hussain32190;2018-03-12 01:40;0;0;"Öl Ölpreis ( Brent ) | Brent Crude Oil |... http://www. xtfast.com/de/ol.php";;;;"973056094896558080";https://twitter.com/hussain32190/status/973056094896558080
Ole_S_Hansen;2018-03-11 08:45;15;13;"It was a relatively quiet week in energy with funds responding to the current lack of direction by reducing bullish #oil bets in #WTI and #Brent by a combined 24k lots to 985k lots #OOTT pic.twitter.com/LBVznKoj8m";;;#oil #WTI #Brent #OOTT;"972800802346725381";https://twitter.com/Ole_S_Hansen/status/972800802346725381
JavierBlas;2018-03-07 15:25;12;8;"Physical #oil market feeling the soft seasonal demand with refinery turnaround. Look at Russian Ural crude, trading at its largest discount to Brent in the Mediterranean market in 4 years -- via @rupertrowling #OOTT";;@rupertrowling;#oil #OOTT;"971451913991544832";https://twitter.com/JavierBlas/status/971451913991544832
AlertTrade;2018-03-06 05:40;0;0;"Mine Bitcoin Promo BRENT OIL http:// dlvr.it/QJvjN0 promo HF18SPRNGSL10 via http:// bit.do/h-flare pic.twitter.com/SJcPZ9s5UH";;;;"970942095501348864";https://twitter.com/AlertTrade/status/970942095501348864
JackieForrest;2018-03-05 17:37;8;28;"Pedro Parente CEO of Petrobras says Presalt breakeven price of $30 to $40/B ( Brent ) vs $70/B before downturn, lifting costs are down to $7/B. Local content rules are better now. He is very optimistic about development #oil #CERAWeek";;;#oil #CERAWeek;"970760241079078912";https://twitter.com/JackieForrest/status/970760241079078912
OwaisGandhi;2018-03-04 04:00;23;22;"#महंगाई_की_मार Rising oil put further pressure on inflation. Brent crude prices increased 9.1 percent month-on-month during November. This would have affected fuel inflation and spilled over to the transport category, said Morgan Stanley research in a prior note. pic.twitter.com/7twooguzQI";;;#;"970192331247964160";https://twitter.com/OwaisGandhi/status/970192331247964160
Petro_online;2018-03-03 17:02;10;14;"The price of Brent crude recently spiked to US$70 a barrel for the first time since 2014 https://www. petro-online.com/news/flow-leve l-pressure/12/breaking-news/oil-prices-hit-four-year-high/45238 … #oil #brent #oilprices pic.twitter.com/u8SlC5Gume";;;#oil #brent #oilprices;"970026702058459136";https://twitter.com/Petro_online/status/970026702058459136
chigrl;2018-03-03 11:54;19;39;"10yr forward inflation expectations v Brent spot #oil price #oott pic.twitter.com/0JsXMl05a0";;;#oil #oott;"969949047636287488";https://twitter.com/chigrl/status/969949047636287488
MboyaApollo;2018-03-03 05:28;71;55;"As the prices of the monthly Brent Oil declined, @energy_ke adjusted upwards the Fuel levy in the electricity bills @KenyaPower to fleece the consumers & enrich the power cartels #SwitchOffKPLC pic.twitter.com/JG5Xs7cKkL";;@energy_ke @KenyaPower;#SwitchOffKPLC;"969852035871989760";https://twitter.com/MboyaApollo/status/969852035871989760
RogueCoder250;2018-03-02 08:11;15;24;"Production cost: $15 per barrel Today's Brent crude oil price: $62.92 Yet we are PAYING the oil companies to take it. Welcome to Tory "economics".";;;;"969530575609585664";https://twitter.com/RogueCoder250/status/969530575609585664
charttec;2018-02-26 17:17;0;0;"Neue Wochenanalyse Brent Oil Future ICE (26.02.2018): http://www. charttec.de/html/analyse_s tart.php …";;;;"968218568226635776";https://twitter.com/charttec/status/968218568226635776
Schuldensuehner;2018-02-18 19:44;24;27;"Volatile #oil casts doubt on #ECB 's favorite future #inflation gauge. Inflation expectations (measured by 5y5y swap) trades more or less in lockstep w/ Brent crude. pic.twitter.com/zOwB8zj9sm";;;#oil #ECB #inflation;"965341349045252096";https://twitter.com/Schuldensuehner/status/965341349045252096
josch2012;2018-02-18 14:20;0;0;"Brent Crude Oil Chartanalyse KW07-08/18 - an 65$ Marke gescheitert - Kursziel: Rückgang auf 60-62$ oder > 66$ ?? https:// rohstoff.boersentagebuch.eu/?p=1162";;;;"965259672671440896";https://twitter.com/josch2012/status/965259672671440896
AdamMancini4;2018-02-17 15:13;12;51;"$ OIL Funds were a near record 6.9% short last week (~15/1 long to short). Huge risk remains: Refinery maintenance season + shrinking Brent - #WTI spread are bearish demand now, and the recent bounce in oil was $ USD driven. If $ USD rebounds, little to stop oil from squeezing to $56 pic.twitter.com/Qea1r71zbQ";;;#WTI;"964910804549165056";https://twitter.com/AdamMancini4/status/964910804549165056
payoff_ch;2018-02-14 14:15;0;0;"Gewinner des Tages: MCOAYV @Vontobel_FP_CH Mini-Future auf ICE Brent Crude Oil Front Month Future mit 95% http:// payoff.ch/CH0389700243";;@Vontobel_FP_CH;;"963808838989336576";https://twitter.com/payoff_ch/status/963808838989336576
ariva;2018-02-12 11:51;0;0;"Die #OPEC erhöht ihre #Rohöl -Angebotsprognose für Länder außerhalb des Kartells erneut. Im Vergleich zum Vorjahr solle die Produktionsmenge um durchschnittlich 1,4 Millionen Barrel pro Tag ansteigen. #WTI #Brent #oil https://www. ariva.de/news/roundup-o pec-erhoeht-erneut-angebotsprognose-fuer-laender-6798729 …";;;#OPEC #Roh #WTI #Brent #oil;"963047919418036226";https://twitter.com/ariva/status/963047919418036226
NileshShah68;2018-02-12 06:16;39;214;"From March 26, China the world's largest buyer of oil will list yuan oil futures on Shanghai exchange. Can yuan oil futures give direct competition to dollar denominated Brent and WTI ?";;;;"962963486564388864";https://twitter.com/NileshShah68/status/962963486564388864
Ole_S_Hansen;2018-02-11 08:23;14;20;"Funds cut bullish #oil bets in WTI and Brent by just 26.4k lots in the wk to Feb 6. By then the price rout had only just begun. Fading momentum, rising US production, stock market turmoil and aggressive long liquidation helped trigger the worst week for oil since 2016. #OOTT pic.twitter.com/ONvDicEqku";;;#oil #OOTT;"962633267764752384";https://twitter.com/Ole_S_Hansen/status/962633267764752384
spectatorindex;2018-02-10 14:20;137;116;"Brent crude oil price. One year ago: $56.3 Six months ago: $48.1 Three months ago: $63.4 One month ago: $68.8 One week ago: $69.6 Now: $62.8";;;;"962360511458304001";https://twitter.com/spectatorindex/status/962360511458304001
WSJ;2018-02-09 08:10;42;39;"China is set to launch its crude oil futures contract next month as it attempts to rival London’s Brent crude futures and New York’s WTI futures http:// on.wsj.com/2nKTPCQ";;;;"961905034404483074";https://twitter.com/WSJ/status/961905034404483074
AdamMancini4;2018-02-08 12:01;5;24;"Nice reminder of where $ OIL short interest stands: At a record low 6.8%. Oil broke its uptrend channel from Sept yesterday & the risk of a large long liquidation is now very real. A bouncing $ USD , US production surprising to the upside,and shrinking Brent - #WTI spread wont help pic.twitter.com/CfnDVbMy2U";;;#WTI;"961600964095627265";https://twitter.com/AdamMancini4/status/961600964095627265
Ole_S_Hansen;2018-02-08 06:54;11;74;"#Brent crude #oil has reached its s/t target based on H&S breakout #OOTT pic.twitter.com/XBmdz0z21i";;;#Brent #oil #OOTT;"961523691766067200";https://twitter.com/Ole_S_Hansen/status/961523691766067200
JavierBlas;2018-02-06 10:19;28;44;"Brent crude #oil breaks below the 50-day moving average -- $ GS obviously timed its bullish 3- and 6-month oil call really well... #OOTT pic.twitter.com/hzHB5Gn1y1";;;#oil #OOTT;"960850470377009152";https://twitter.com/JavierBlas/status/960850470377009152
OilSheppard;2018-02-06 07:02;11;12;"Vitol's Ian Taylor says oil fundamentals looks "very solid" but side-eyes Goldman saying their $85/bbl Brent call might be a bit much. https://www. bloomberg.com/news/videos/20 18-02-06/vitol-ceo-taylor-on-oil-opec-cuts-shale-aramco-ipo-video … "Do I see Goldman's numbers? Nah... they have to sell something, don't they?" #OOTT";;;#OOTT;"960800970715385856";https://twitter.com/OilSheppard/status/960800970715385856
de_tradingview;2018-02-05 20:50;0;1;"$ UKOIL - Crude Oil Brent mit größeren Korrektur? - https:// de.tradingview.com/chart/UKOIL/4C ErjoQe/ …";;;;"960646723520442368";https://twitter.com/de_tradingview/status/960646723520442368
JavierBlas;2018-02-05 20:29;24;16;"Brent crude #oil down to $67 a barrel -- nearly wiping out all 2018 gains. #OOTT #OPEC #shale pic.twitter.com/vkdmHKBJVY";;;#oil #OOTT #OPEC #shale;"960641499670237185";https://twitter.com/JavierBlas/status/960641499670237185
charttec;2018-02-05 18:11;0;0;"Neue Wochenanalyse Brent Oil Future ICE (05.02.2018): http://www. charttec.de/html/analyse_s tart.php …";;;;"960606742269874176";https://twitter.com/charttec/status/960606742269874176
PeterLBrandt;2018-02-02 14:49;63;164;"Brent Crude topping with H&S pattern. @BrynneKKelly @chigrl $ IC_F $ CO_F $ OIL pic.twitter.com/FLXwliHG2R";;@BrynneKKelly @chigrl;;"959468818543263744";https://twitter.com/PeterLBrandt/status/959468818543263744
JavierBlas;2018-02-01 06:32;77;66;"Here we go: Goldman Sachs raises Brent #oil 3-month forecast to $75 a barrel (from $62 a barrel). And 6-month forecast to $82.5 a barrel #OOTT $ GS pic.twitter.com/vZ28JOpiJ8";;;#oil #OOTT;"958981448555466754";https://twitter.com/JavierBlas/status/958981448555466754
Rog_Anderson;2018-01-30 07:53;22;19;"What Tory/Brexit/Union supporting Telegraph fails to say here is that whilst US$ is weakening as a result of higher oil prices& US being an oil importer the UK£ is strengthening because its a net exporter of Brent . i.e. it's Scotland’s oil that's helping to keep the £ afloat! pic.twitter.com/ZpS7d4Cqqf";;;;"958277010878533632";https://twitter.com/Rog_Anderson/status/958277010878533632
Schuldensuehner;2018-01-29 12:25;36;18;"#Oil keeps correcting. Brent drops below $70/bbl as higher prices have generated a first big supply response among US producers. Latest data showed a jump of 12 operating rigs last week to the highest since late Aug. pic.twitter.com/snrt0cYibg";;;#Oil;"957982925819170817";https://twitter.com/Schuldensuehner/status/957982925819170817
jsblokland;2018-01-25 08:12;25;15;"Brent #oil > USD 70! At these levels #oil prices could push headline #inflation towards or even over the #ECB target. pic.twitter.com/lNIyFz63Xh";;;#oil #oil #inflation #ECB;"956469767250071552";https://twitter.com/jsblokland/status/956469767250071552
Ole_S_Hansen;2018-01-25 06:26;28;41;"WTI and Brent crude #oil almost retracing 50% of the 2014-16 sell-off - #oott pic.twitter.com/ldgRwELyj9";;;#oil #oott;"956443168886620160";https://twitter.com/Ole_S_Hansen/status/956443168886620160
Investingcom;2018-01-25 06:20;7;27;"Brent oil prices hit $71 per barrel on Thursday for the first time since 2014 as the dollar continued to weaken - https:// invst.ly/6fpv6";;;;"956441538782953472";https://twitter.com/Investingcom/status/956441538782953472
Schuldensuehner;2018-01-25 05:05;20;17;"Asia stocks falling, led lower by Japan on Yen strength. This is not really a Risk-Off move, but instead, primarily due to Dollar weakness, JPM says. Brent oil extends climb above $71 a barrel. pic.twitter.com/fR9VZWJa8j";;;;"956422792609746945";https://twitter.com/Schuldensuehner/status/956422792609746945
Reuters;2018-01-25 05:00;56;34;"Brent oil hits $71 for first time since 2014 as dollar drops, U.S. stocks decline http:// reut.rs/2E7F9EI pic.twitter.com/wnrzmYJ3ED";;;;"956421452152098816";https://twitter.com/Reuters/status/956421452152098816
bluelinealert;2018-01-25 04:22;0;0;"#brent #gold #stocktrade #oil #silver #china #forexsignals #uso | Klimt - The Kiss 1908 | http:// ift.tt/2C3bhuy pic.twitter.com/AR0XREnnZC";;;#brent #gold #stocktrade #oil #silver #china #forexsignals #uso;"956411958428774400";https://twitter.com/bluelinealert/status/956411958428774400
business;2018-01-24 23:09;26;28;"Oil companies to reopen their checkbooks as Brent crude surpasses $70 https:// bloom.bg/2rAf7Y1 pic.twitter.com/mGEXJmxPns";;;;"956333234673147905";https://twitter.com/business/status/956333234673147905
OilPriceHourly;2018-01-24 20:00;10;13;"#Oil Price Update: $70.74 ( #Brent $ Crude ) #oilprice source http:// bbc.in/1SSyzn8";;;#Oil #Brent #oilprice;"956285593998315521";https://twitter.com/OilPriceHourly/status/956285593998315521
Ole_S_Hansen;2018-01-24 13:40;24;21;"WTI crude #oil trading higher following the #EIAReport with the discount to Brent narrowing to $4.9/b. This following another stock reduction, not least at Cushing. Production moved closer to 10m b/d while refinery activity continued to slow. #OOTT pic.twitter.com/g9qjkjqiIe";;;#oil #EIAReport #OOTT;"956189944812331008";https://twitter.com/Ole_S_Hansen/status/956189944812331008
hgloystein;2018-01-23 23:16;13;15;"#Oil markets remain strong, but demand for put options to sell #Brent is rising fast #OOTT #Reuters https:// af.reuters.com/article/commod itiesNews/idAFL4N1PJ11I … pic.twitter.com/F1ZVuB9jeH";;;#Oil #Brent #OOTT #Reuters;"955972636898615296";https://twitter.com/hgloystein/status/955972636898615296
JavierBlas;2018-01-23 14:06;33;30;"Brent #oil surges above $70 a barrel again #OOTT";;;#oil #OOTT;"955834009883422726";https://twitter.com/JavierBlas/status/955834009883422726
JavierBlas;2018-01-23 07:19;25;25;"EXCLUSIVE: #Oil hedge fund BBL Commodities (one of the largest specialist, with $600 million AUM) sees Brent going up to $80 a barrel in 2018; warns crude inventories lower than market perceives #OOTT https://www. bloomberg.com/news/articles/ 2018-01-23/oil-hedge-fund-bbl-commodities-sees-brent-at-80-on-opec-cuts …";;;#Oil #OOTT;"955731669662695424";https://twitter.com/JavierBlas/status/955731669662695424
markets;2018-01-23 06:48;28;21;"Oil hedge fund BBL Commodities sees Brent at $80 on OPEC cuts https:// bloom.bg/2DDrPKw via @JavierBlas2 pic.twitter.com/AESFlyVN2W";;@JavierBlas2;;"955723791291895808";https://twitter.com/markets/status/955723791291895808
josch2012;2018-01-21 13:42;0;0;"Brent Crude Oil Chartanalyse KW03-04/18 - Kurs liegt unter 69$ - Bruch der EMA 20 oder Anstieg in den Bereich 70-72$? https:// rohstoff.boersentagebuch.eu/?p=1127";;;;"955103280711028736";https://twitter.com/josch2012/status/955103280711028736
C_Barraud;2018-01-20 11:01;14;21;"#OOTT | Crude #Oil Managed money combined net position in Nymex #WTI , ICE WTI and #Brent contracts rose to 1112.8 million barrels (new record high) vs 1075.3 million prior. pic.twitter.com/2d3NCk0vKb";;;#OOTT #Oil #WTI #Brent;"954700285296996352";https://twitter.com/C_Barraud/status/954700285296996352
IEA;2018-01-19 07:17;35;22;""The price of Brent crude oil closed earlier this week above $70 per barrel for the first time since the end of 2014" Our December oil market report is out now: http:// bit.ly/2FTwzde #OOTT";;;#OOTT;"954281732265529344";https://twitter.com/IEA/status/954281732265529344
