username;date;retweets;favorites;text
dock_tank;03/08/2019 07:06;9;67;Theory: 'Arry and Bert are at Ffarquhar Quarry all the tine because they now mine iron ore , so they're apways there collecting it and taking it to the ironworks. (I know it doesn't look like iron ore in the trucks but whatever) pic.twitter.com/ptlw6r8fg3
OmasoroO;03/08/2019 06:43;330;586;African Natural Resources and Mines signed a deal with Nigeria to invest $600million in iron ore and steel production. Their plant will also generate enough heat that will produce 34mw electricity,and supply from their kaduna plant. This is a major boost to our steel production. pic.twitter.com/C5gu9P8cJs
Ashi_IndiaToday;02/08/2019 00:34;1059;1003;"#AndhraPradesh IFS officer Kallol Biswas who had earned fame after serving notices to Bellary mining king #GaliJanardhanReddy for alleged irregularities"" done by his Obulapuram Mining Corporation and encroaching forest land for illegal iron ore mining sacked by the centre. pic.twitter.com/w0VTC9TiEJ"""
YuanTalks;01/08/2019 22:05;40;76;#China A50 futures tumbling near 3%. China’s #CrudeOil and #IronOre futures down 4.6% and 4.1%. #Cotton futures and #coke futures limit down. pic.twitter.com/rK0bvGHeIN
Condor_Law;01/08/2019 01:03;62;61;Since 2013, #Soros has spent $41.9 million financing #OpenBorders #NGOs & Liberal protest groups. He is currently sued by the state of Israel for $10 billion for orchestrating the African country of Guinea’s freezing of Israeli iron ore mining contracts! https://www. lifesitenews.com/news/billionai re-leftist-soros-pouring-more-money-into-lobbying-efforts …
PaulBassat;31/07/2019 23:18;22;124;Our 3 largest exports are iron ore , coal & education All 3 have a single point of failure: Iron ore : fall in price of iron ore Coal: fall in price of coal (coking & thermal) Education: Chinese Govt discouraging students from coming here We need to urgently diversify our economy
nendaas1;31/07/2019 22:44;2;2;WINDMILLS!!!! A windmill is made of 260 tons of steel that required 300 tons of iron ore &170 tons of coking coal all mined transported & produced by hydrocarbons A windmill could spin until it falls apart &never generates as much energy as was invested in building it #DemDebate2
darshanvmehta1;31/07/2019 22:38;5;10;"GLOBAL CUES US markets down 1% as US FED says rate cut not necessarily start of easing cycle Asia weak, SGX Nifty down Crude down 1.6% after 5 days of gains Most metals on LME close down; DCE iron ore down 2%"
AusPropJournal;31/07/2019 22:28;0;0;AS iron ore prices hit 2014 levels, the owners of the Seasons Hotel Newman in regional Western Australia have listed the short stay accommodation asset for sale. #cre #commercialproperty https://www. australianpropertyjournal.com.au/2019/07/31/a-h otel-for-all-seasons/ …
ExaminerOnline;31/07/2019 22:14;0;0;Venture Minerals picks Shaw Contracting for Riley iron ore mining http:// bit.ly/2Zx6oTb
brutal__reality;31/07/2019 22:09;1;0;"Follow #Pepperstone FX tweets may #LOSE * #money * Said #NZDUSD @~ 0.671 holding well may expecting a  #rally "" BUT #really ? #NZDUSD #FALL ~ 0.654 #trading #eurusd #usdjpy #gbpusd #audusd #usdcad #usdchf #nzdjpy #usdtry #asx200 #iron #ore #crude #oott #shares #crypto #fed #fomc pic.twitter.com/IaXlaKaBZk"""
Easttoday1;31/07/2019 22:05;0;0;Most commodity #futures opened low in #China , with iron ore led the decline trend. The iron ore main contract i2001 fell 2.4%.
rflrueda;31/07/2019 21:54;0;1;What about China Iron Ore inventories?
julia16815;31/07/2019 21:53;0;2;A surplus of $2.2B as long as Brazil can’t fix their mines and environmental crime and the price of iron ore continue to soar, as long as they continue to defund Medicare, Education and Welfare services. Surplus indeed! #auspol https:// twitter.com/DaveyDogs/stat us/1156291666841497600 …
vishakha_lion;31/07/2019 21:51;0;0;Chinese #steel output in 2H19 may be crucial in determining whether #iron ore pricing remains close to multi-year highs or falls back, while recent historic trends could imply a limited decline for steel production http:// ow.ly/2zrW30pgjak
MagnetiteMines;31/07/2019 21:41;0;0;Potentially transformational for South Australia @Mining_EnergySA #ironore #GradeMatters #Commodities @CameronEngland #ausbiz https://www. adelaidenow.com.au/business/sa-bu siness-journal/energy-mining-department-chief-executive-paul-heithersay-reveals-targets-for-resources-and-renewables/news-story/82a3d6d480ee041a99d6d4855ac98577 …
MagnetiteMines;31/07/2019 21:41;2;3;"DPT for #Energy & #Mining Paul Heithersay keen to see SA's #magnetite industry take off. “We know that magnetite is the #ironore of choice for the future because of its low environmental impact, it’s less energy intensive. We’ve got a lot of it in South Australia @CameronEngland pic.twitter.com/3pO5u1xhco"""
Happy19112;31/07/2019 21:32;0;0;It’s part of a short line in Eastern Tennessee that supplied iron ore during the Civil War,
hiool;31/07/2019 21:12;0;0;China steel rebound fizzles, iron ore rally loses steam https://www. hellenicshippingnews.com/china-steel-re bound-fizzles-iron-ore-rally-loses-steam/ …
hiool;31/07/2019 21:12;0;0;Analysis: China steel output key for iron ore , H2 decline may be limited https://www. hellenicshippingnews.com/analysis-china -steel-output-key-for-iron-ore-h2-decline-may-be-limited/ …
